Product_ID,Product_Name,Domain,Product_Price
B003UB1JAG,"Luvable Friends 7 Piece Bold Sayings Bibs, Blue",Baby Products,
B003UERR22,Ju-Ju-Be Coastal Collection Newport - B.F.F.,Baby Products,$134.08
B003UF6NVW,"The First Years Take & Toss Spill-Proof Sippy Cups with Removable Handles, 7 Ounce, 4 Pack",Baby Products,$2.68
B003UGLO1K,,Baby Products,
B003ULP592,,Baby Products,
B003ULP59M,Dexbaby Diaper Caddy and Nursery Organizer for Baby's Essentials,Baby Products,$21.99
B003UPDVG2,Medela 150 Ml Storage Bottle Case of 10 BPA FREE,Baby Products,
B003UPESKU,,Baby Products,
B003UTUEOU,Boppy Prenatal Total Body Pillow (Discontinued by Manufacturer),Baby Products,
B003UWY8LW,,Baby Products,
B003UYU0RG,"C.R. Gibson First Five Years Memory Book, Classic Pooh (Discontinued by Manufacturer)",Baby Products,
B003UYU0S0,,Baby Products,
B003V54TGM,,Baby Products,
B003V5LA5K,"Tilty Slow Flow Cup Lids, 2 Pack",Baby Products,
B003V6V4EQ,"Baby Blinds Breastfeeding Cover (Regular, Olivia)",Baby Products,
B003V9PXE0,,Baby Products,
B003VHYM44,,Baby Products,
B003VIIUDW,Fisher-Price Ocean Wonders Deep Blue Sea Mobile Fisher-Price Crib Mobiles Remote Control,Baby Products,$99.95
B003VKGIHU,"Graco Portland Combo Dresser, White (Discontinued by Manufacturer)",Baby Products,
B003VKPDVW,Ameda Flexshield Aereola Stimulator - 2 Pk,Baby Products,$19.50
B003VKYL3I,,Baby Products,
B003VKZD6M,"SwaddleDesigns Marquisette Swaddling Blanket, Premium Cotton Muslin, Kiwi Paisley",Baby Products,$12.10
B003VLAXN4,bumGenius One Size Pocket Diaper 4.0 (Hook & Loop) Butternut,Baby Products,$17.99
B003VLG4PK,bumGenius One-Size Reusable Pocket-Style Snap-Closure Cloth Diaper 4.0 (Girl Stripe),Baby Products,$16.95
B003VM8S2Q,"Pickles Nummy Animal Snuggly Banky, Ivory Lamb, 16 X 16"" (Discontinued by Manufacturer)",Baby Products,
B003VNKLFC,"Regalo Guardian Expandable Gate, White (Discontinued by Manufacturer)",Baby Products,
B003VNKLHA,"Regalo Extra WideSpan Walk Through Safety Gate, White",Baby Products,$42.98
B003VNKLHK,"Regalo Extra Tall Widespan Gate, White",Baby Products,
B003VNKLI4,"Regalo Top Of Stairs Expandable Metal Gate, With Mounting Kit",Baby Products,$42.59
B003VNKLIE,"Regalo Extra Tall Top Of Stairs Gate, With Banister and Wall Mounting Kits, 34-55 inches wide",Baby Products,$47.99
B003VNKLIY,"Regalo 192-Inch Super Wide Gate and Play Yard, White",Baby Products,$89.99
B003VQRJAO,"Apple Park Picnic Pal Organic 3-Piece 3"" x 3"" Soft Block Set, White",Baby Products,$22.32
B003VS3QH2,Classic Pooh Flat Blankie Teether Toy,Baby Products,$9.84
B003VTM6IG,ERGO Baby Carrier - Performance Grey,Baby Products,$135.00
B003VTM8HA,"ERGOBaby Performance Baby Carrier with Attached Sleeping Hood, in Spring Green",Baby Products,
B003VTZKOI,"Bright Starts Walk-A-Bout Walker, Cute Frog (Discontinued by Manufacturer)",Baby Products,
B003VTZM2I,Sassy Newborn Gift Set,Baby Products,$9.99
B003VTZM32,"Sassy Gift Set, 3+ Months",Baby Products,
B003VWCYTY,"Hoohobbers Rocking Chair, Blue Mesh",Baby Products,$50.00
B003VWD3PI,"Thermos Dual Compartment Lunch Kit, Dora The Explorer (Discontinued by Manufacturer)",Baby Products,
B003VWD3QC,"Thermos Funtainer 12 Ounce Bottle, Mickey Mouse",Baby Products,$17.99
B003VZ8BXO,Baby Trend Expedition ELX Travel System Stroller - Everglade,Baby Products,
B003WG0040,Kidz Delight Tech Set Trio,Baby Products,
B003WIYNY6,"Baby Jogger 2011 City Mini Single Stroller, Black/Black (Discontinued by Manufacturer)",Baby Products,
B003WIYO0Y,"Baby Jogger 2011 City Mini Double Stroller, Black/Black (Discontinued by Manufacturer)",Baby Products,
B003WKW6J8,MOBI Tykelight GloMate Jr. Color-Changing Baby Night Light,Baby Products,
B003WKZ4Y2,The First Years Sounds For Silence Nursery Sound Machine (Discontinued by Manufacturer),Baby Products,
B003WM7WRW,"Blueberry Coveralls Hook/Loop Diaper, Cow (Discontinued by Manufacturer)",Baby Products,
B003WUXIZO,"American Baby Company Sheet Saver, Teddy Bear Pattern, Blue",Baby Products,
B003X3R6TO,"GroVia Reusable Baby Cloth Diaper Wipes, 12 Count",Baby Products,$10.95
B003X3VTAG,"Ju-Ju-Be Memory Foam Changing Pad, Midnight Eclipse",Baby Products,
B003XDB91U,"KLADD PRICKAR Bib, assorted sets of red and blue - pack of 2",Baby Products,$12.89
B003XLUWT2,"Blueberry Minky Diaper Snaps, Blue on Chocolate (Discontinued by Manufacturer)",Baby Products,
B003XMWF2S,"Munchkin Sesame Street Toddler Fork and Spoon, Elmo",Baby Products,
B003XMWF4G,Munchkin Sesame Street Toddler Plate,Baby Products,
B003XMWF5A,Munchkin Sesame Street Toddler Bowl,Baby Products,$10.12
B003XMWF7S,"Munchkin 2 Pack Sesame Street Insulated Spill-Proof Cup, 9 Ounce, Colors May Vary (Discontinued by Manufacturer)",Baby Products,
B003XMWF8W,"Munchkin Arm and Hammer Diaper Disposal Bags, Blue, 50 Pack (Discontinued by Manufacturer)",Baby Products,
B003XMWFAK,"Munchkin Stroller Hook,, Colors May Vary (Discontinued by Manufacturer)",Baby Products,$10.55
B003XMWFAU,"Munchkin Stroller Links, Black (Discontinued by Manufacturer)",Baby Products,
B003XMWFB4,"Munchkin Stroller Insulated Cup Holder, Black (Discontinued by Manufacturer)",Baby Products,
B003XR5NVS,"Britax B-Ready Stroller Bassinet, Red (Prior Model)",Baby Products,
B003XT43MG,"Moonlight Slumber Little Dreamer Dual Sleep Surface Crib Mattress - Waterproof, Hypoallergenic, and Antimicrobial Lightweight Crib Mattress with Extra Firm Infant Side and Plush Toddler Side",Baby Products,
B003Y2UZ42,Olive N Figs Quilted Diaper Bag with Changing Pad - Midnight Daisies,Baby Products,
B003Y53YR4,"Baby Trend Expedition LX Travel System, Millennium",Baby Products,$174.99
B003Y5B7K0,"Parent Units Double Door Fridge Guard, Black Strap",Baby Products,$5.99
B003Y5U4D6,Certified Baltic Amber Teething Necklace for Baby (Rainbow bean) - Anti-inflammatory,Baby Products,$11.99
B003Y732HE,"Philips AVENT BPA Free Toddler Gift Set, 6+ Months (Discontinued by Manufacturer)",Baby Products,$50.90
B003Y732II,"Philips AVENT BPA Free Toddler Bowl Set, 6+ Months, 2-Pack (Discontinued by Manufacturer)",Baby Products,$29.90
B003Y732IS,"Philips AVENT BPA Free Toddler Weaning Spoons, 6+ Months (Discontinued by Manufacturer)",Baby Products,$14.90
B003Y737DS,"Baby Buddy ""Size-It"" Closet Organizers, Pink",Baby Products,$4.99
B003YC0W7W,Philips AVENT Baby Monitor with Temperature and Humidity Sensors and New Eco Mode (Discontinued by Manufacturer),Baby Products,
B003YC0W86,Philips AVENT Digital Video Baby Monitor (Discontinued by Manufacturer),Baby Products,
B003YC0W8G,Philips AVENT DECT Baby Monitor with Temperature Sensor and New ECO Mode (Discontinued by Manufacturer),Baby Products,
B003YDWU2Q,Beco Gemini Baby Carrier Dragonfly - Multi-Position Soft Structured Sling w/ Adjustable Straps & Comfort Padding for Infant/Toddler Hip Support - Dragonfly with Pocket,Baby Products,$140.00
B003YDWU30,Beco Baby Carrier Gemini - Espresso,Baby Products,
B003YF1XPY,"Blueberry Solid Colors Diaper Laundry Bag, Amber",Baby Products,
B003YFHZI8,"Label Itz Bandle Bottle Labels, Baby Time (Discontinued by Manufacturer)",Baby Products,
B003YHM324,"Luvable Friends Disposable Bibs, White, 24-Count",Baby Products,
B003YHUVH8,,Baby Products,
B003YI4TSY,Dreambaby Baby on Board Sign,Baby Products,$3.37
B003YLEU1M,"MAM 3-Pack BPA Free Bottle, Boy, 5 Ounce (Discontinued by Manufacturer)",Baby Products,
B003YLGBBY,"BreathableBaby Breathable Deluxe Mesh Crib Liner, Chocolate/Ice Blue Fauna",Baby Products,
B003YNL6M6,"Blueberry Trainers Pants, Pink, Large (Discontinued by Manufacturer)",Baby Products,
B003YV3S1A,FuzziBunz Elite 2013 One Size Cloth Diapers 12 Pack Gender Neutral Colors with Dainty Baby Wet Bag and Rockin Green Laundry Detergent Sample Bundle,Baby Products,
B003YVHXAW,Safety 1st Adapter and Plug Cover,Baby Products,
B003YVTSMS,"Disney Rapunzel 4 Piece Toddler Set, Purple (Discontinued by Manufacturer)",Baby Products,
B003YZP076,"Kinderville Bigger Bites Divided Plates (Set of 2, Pink/Purple)",Baby Products,
B003Z6AO7U,"Brown Monkey Baby Bottle Holder for Hands Free Bottle Feeding by Bebe Bottle Sling, LLC",Baby Products,$19.95
B003Z6Q3V6,"Boba Classic Baby Carrier, Twilight (Discontinued by Manufacturer)",Baby Products,
B003ZA4C8I,"SwaddleDesigns Cotton Crib Sheet, Made in USA, Premium Cotton Flannel, Kiwi Paisley",Baby Products,$16.99
B003ZFPRHS,Ozeri Turtlemeter The Baby Bath Floating Turtle Toy and Bath Tub Thermometer,Baby Products,$12.95
B003ZL71VC,"The Woombie Leggies Swaddle Blanket with Legs, Baby Green/Sage, 6-9 Months",Baby Products,
B003ZO072Y,"Trend Lab Ultimate Diaper Bag, Brown/Blue",Baby Products,
B003ZUXB5I,"Philips AVENT 2 Pack BPA Free Decorated Cup, 18+ Months, 12 Ounce, Styles and Designs May Vary",Baby Products,
B003ZUXBBC,"Philips Avent BPA Free Classic Bottle to First Cup Trainer, 4+ Months, Clear (Discontinued by Manufacturer)",Baby Products,$9.92
B003ZUXNQA,"Snuggin Go Reversible Strap Covers, Black",Baby Products,$10.50
B003ZUXQVW,"JJ Cole Diaper Stacker, Blue Stripe (Discontinued by Manufacturer)",Baby Products,$29.99
B003ZUXQXU,"JJ Cole Car Seat Cover, Khaki",Baby Products,
B003ZUXU40,"Infantino Balance Baby Carrier, Spindles, 8-35 Pounds (Discontinued by Manufacturer)",Baby Products,
B003ZUXU4K,Infantino Infinity Baby Carrier,Baby Products,$39.89
B003ZUXU4U,"Infantino Ecosash Baby Carrier, Bloomin Vines, 8-35 Pounds (Discontinued by Manufacturer)",Baby Products,
B003ZYE7F2,"Munchkin Feeding Set, 15 Pack",Baby Products,$14.95
B003ZYE7FC,,Baby Products,
B003ZYEDDI,"Tadpoles 16 Sq Ft Hearts and Stars Playmat Set, Pink/Purple/White",Baby Products,$17.00
B003ZYEEDM,"Tadpoles 12"" Playmat, 9 Piece Set, Natural Wood Print",Baby Products,$19.99
B004044LD4,,Baby Products,
B00404AKR0,"Luvable Friends Flannel Receiving Blankets, Blue, 5 Pack",Baby Products,
B004071ZJ4,"Baby Aspen, Ekko the Elephant Little Expeditions Plush Rattle Lovie with Crinkle Leaf, Gray, 0-24 Months",Baby Products,
B004071ZLC,"Baby Aspen Baby Chef 3 Piece Layette in Culinary Gift Box, White, 0-6 Months",Baby Products,$24.24
B004071ZO4,,Baby Products,
B004071ZOY,"Baby Aspen ""Let the Fin Begin"" Blue Terry Shark Robe, Blue, 0-9 months",Baby Products,$14.50
B004071ZQ2,"Baby Aspen, Snug As a Bug Ladybug Snuggle Sack, 0-6 Months",Baby Products,$25.99
B004071ZR6,,Baby Products,
B0040A12VW,"Skip Hop Versa Expandable Diaper Bag, Cream Links",Baby Products,
B0040E9K30,,Baby Products,
B0040GJ0U6,Infantino Activity Stacker (Discontinued by Manufacturer),Baby Products,
B0040GJ0UG,,Baby Products,
B0040GJ0UQ,,Baby Products,
B0040GJ0V0,Infantino Dansy Antsy (Discontinued by Manufacturer),Baby Products,
B0040GJ0VK,,Baby Products,
B0040GJ0VU,"Infantino Cloud Cart Cover, Numbers (Discontinued by Manufacturer)",Baby Products,
B0040IWMO0,,Baby Products,
B0040IWMTK,"Charlie Banana 10 Reusable Double Sided Wipes, Blue Emb.",Baby Products,$13.62
B0040J3H02,,Baby Products,
B0040JZ2RS,"GroVia Organic Cloth AIO Diaper, Vanilla (Discontinued by Manufacturer)",Baby Products,$23.95
B0040JZ4VC,,Baby Products,
B0040K2Z40,,Baby Products,
B0040K4K2A,,Baby Products,
B0040QQF54,Bright Starts Baby's Play Place Deluxe,Baby Products,
B0040T6LUU,"Luvable Friends 12 Pack Washcloths, Blue",Baby Products,$9.05
B004184QAW,"Britax Convertible Child Cup Holder, Cool Gray",Baby Products,$15.00
B0041F2CDI,Valco Baby Glo Bugz Flashing Safety Lights (Discontinued by Manufacturer),Baby Products,
B0041F49Z2,,Baby Products,
B0041H2V7S,,Baby Products,
B0041IIG6C,,Baby Products,
B0041IYOFE,,Baby Products,
B0041IYOG8,"Ergobaby Options Baby Carrier, Black (Discontinued by Manufacturer)",Baby Products,$120.00
B0041Q2V4W,Motorola Digital Video Baby Monitor with Room Temperature Thermometer (Discontinued by Manufacturer),Baby Products,
B0041Q2V5Q,,Baby Products,
B0041Q3KDI,,Baby Products,
B0041RRX6M,,Baby Products,
B0041SRGG8,Rockin Green Magnetic Laundry Scoop - Grey,Baby Products,
B0041WQUSE,ERGO Baby - Water Resistant Weather Cover,Baby Products,
B004201GHK,Vulli Products - Sophie The Giraffe Teething Ring - Gift Boxed! - 100% Natural rubber,Baby Products,
B004203QQ4,Vulli Sophie The Giraffe Teether Toy Set - (Includes The Original Sophie + New Sophie The Giraffe Vanilla Teething Ring),Baby Products,$38.29
B00421BLV0,"The Woombie Original Swaddle Blanket, Sage, Big Baby (14-19 lbs) (Discontinued by Manufacturer)",Baby Products,$29.99
B00422KTE4,"Catbird Baby Pikkolo Baby Carrier, Cafe au Lait (Discontinued by Manufacturer)",Baby Products,
B00422M5AK,"Britax Foot Muff, Black",Baby Products,$31.63
B00422M5I2,Britax B-Nimble Cup Holder,Baby Products,$14.99
B00422M5JQ,Britax Infant Positioning Insert (Prior Model),Baby Products,$22.95
B00422M5OQ,"Britax B-Ready and B-Scene Boot Cover, Black (Prior Model)",Baby Products,
B00422MIUC,"Prince Lionheart bebePOD Flex Baby Seat, Mint",Baby Products,
B004239Y9O,"Summer Infant 2 Pack Cotton Knit Swaddleme, Green/White",Baby Products,
B004239YNU,"Summer Infant 2 Pack Cotton Knit Swaddleme, White/Pink, 7-14 Pounds (Discontinued by Manufacturer)",Baby Products,$19.99
B00423A60U,"Summer Infant Slumber Buddies, Frog (Discontinued by Manufacturer)",Baby Products,$43.99
B00427NXC4,,Baby Products,
B00428T430,Summer Infant Right Height Center Tub,Baby Products,
B0042A5ZVS,"Safety 1st Sound 'n Lights Activity Walker, Lil' Safari",Baby Products,
B0042AE9EC,Graco Direct Connect Digital Baby Monitor with 2 Parent Units,Baby Products,
B0042AIHMW,Digital Connect Digital Baby Monitor - 1 Parent Unit,Baby Products,
B0042D69UG,,Baby Products,
B0042D69UQ,"Fisher-Price Baby's Bouncer, Adorable Animals",Baby Products,
B0042D69V0,Fisher-Price Luv U Zoo Jumperoo,Baby Products,$99.99
B0042D69VA,Fisher-Price Luv U Zoo Busy Baby Booster (Discontinued by Manufacturer),Baby Products,
B0042D69VK,"Fisher-Price Fold 'n Stow Swing, Adorable Animals (Discontinued by Manufacturer)",Baby Products,
B0042D69VU,Fisher-Price Brilliant Basics 2-in-1 Activity Friends Mobile (Discontinued by Manufacturer),Baby Products,$32.99
B0042D69W4,Fisher-Price Brilliant Basics Fun to Fix Gift Set,Baby Products,$18.99
B0042D69WO,,Baby Products,
B0042D69WY,"Fisher-Price Cradle 'N Swing, My Little Snugabunny (Discontinued by Manufacturer)",Baby Products,$167.02
B0042D69XI,Fisher-Price Brilliant Basics Little Glamour Gift Set,Baby Products,$20.55
B0042D69XS,"Fisher-Price Deluxe Bouncer, My Little Snugabunny",Baby Products,$64.99
B0042D69YM,"Fisher-Price EZ Clean High Chair, Coco Sorbet",Baby Products,$199.99
B0042D69YW,,Baby Products,
B0042D6CHQ,Fisher-Price Whale of a Playtub (Discontinued by Manufacturer),Baby Products,
B0042D6CI0,Fisher-Price Sing with Me Step Stool (Discontinued by Manufacturer),Baby Products,$19.99
B0042FWN40,,Baby Products,
B0042G7FVA,,Baby Products,
B0042G8YCY,,Baby Products,
B0042L31KY,,Baby Products,
B0042LRRRM,"Living Textiles Smart Swaddle Muslin Wraps, Scribble Blue (Discontinued by Manufacturer)",Baby Products,
B0042MEQ7A,"Angel Dear Cuddle Twin Set, Brown Puppy",Baby Products,$24.09
B0042PZC70,"ElecRosa Electrical Outlet Cover, Ivory (Discontinued by Manufacturer)",Baby Products,
B0042QYMDO,Summer Infant Fold Away Baby Bath,Baby Products,
B0042R2IQQ,,Baby Products,
B0042RU2FA,"Skip Hop Baby Treetop Friends Apple Stroller Activity Toy, Multi",Baby Products,
B0042RU2IC,"Skip Hop Set of 2 Zoo Bookends, Dog (Discontinued by Manufacturer)",Baby Products,
B0042RU2SW,,Baby Products,
B0042RU2TQ,"Skip Hop Baby Treetop Friends Animal Ball Activity Toys (3/Pack), Multi",Baby Products,$15.99
B0042RU2UA,"Skip Hop Baby Treetop Friends Hug-and-Hide Wise Owl Activity Toy, Multi",Baby Products,$17.99
B0042RU2UU,"Skip Hop Baby Treetop Friends Animal Ball Activity Toys (3/Pack), Multi",Baby Products,
B0042RU31I,Mobi Tykelight GloMate Plus (Discontinued by Manufacturer),Baby Products,
B0042TO3NK,,Baby Products,
B004305JHC,Diaper Bag Insert Organizer (Green),Baby Products,
B004399AF0,"John Deere Pickles 21X42"" John Deer Nap Mat, Down On The Farm (Discontinued by Manufacturer)",Baby Products,
B00439UNR4,"Thirsties Duo Wrap Snaps Size 1, Gender Neutral, 6 Pack with Dainty Baby Tote Bag",Baby Products,$79.99
B0043C5XYY,"bamboobies Washable Reusable Nursing Pads with Leak-Proof Backing for Breastfeeding, Ultra Thin, 4 Count",Baby Products,$12.99
B0043D28AU,,Baby Products,
B0043D28D2,,Baby Products,
B0043D2A9O,"Safety 1st Alpha Omega Elite Convertible Car Seat, Sassy",Baby Products,$119.99
B0043E6B7K,,Baby Products,
B0043G1MH2,"Kinderglo Portable Fun and Safe Rechargeable Night Light, Elephant",Baby Products,$29.95
B0043G5T08,"Kinderglo Portable Fun and Safe Rechargeable Night Light, Hippo",Baby Products,$29.95
B0043G8OXC,"Kinderglo Portable Fun and Safe Rechargeable Night Light, Bear",Baby Products,$29.95
B0043IS18I,"Dreambaby Stroller Fan, White/Blue",Baby Products,$8.33
B0043M57C2,"Skip Hop Baby Treetop Friends Soft Activity Book, Multi",Baby Products,
B0043QG2DG,Manhattan Toy Wimmer-Ferguson Clip and Discover Shapes Travel Activity Set,Baby Products,$13.99
B0043QKB6K,,Baby Products,
B0043VT9DG,"Bummis Tots Bots Easy Fit Diaper, Starburst, 8-35 Pounds",Baby Products,
B0043XBDOW,"Luvable Friends Dot Print Coral Fleece Blanket, Yellow",Baby Products,
B0043XBDQU,"Hudson Baby Print Coral Fleece Blanket, Blue Chevron",Baby Products,$8.24
B0043XCYL8,"Hudson Baby Plush Blanket with Satin Trim and Backing, Blue (Discontinued by Manufacturer)",Baby Products,
B0043XG2Z2,,Baby Products,
B0043XYXKI,,Baby Products,
B0043YVL7U,,Baby Products,
B00440CZ7I,Pura Kiki Silicone Sip Spouts (Discontinued by Manufacturer),Baby Products,
B00440CZPU,,Baby Products,
B00440CZQ4,,Baby Products,
B00440CZQY,,Baby Products,
B00440CZSC,,Baby Products,
B00440CZSW,"Vital Baby Baby's 1st Feeding Bowls, Pink, 3 Pack",Baby Products,
B00440CZTQ,"Vital Baby Toddler Straw Cup, Orange, 10 Ounce",Baby Products,
B00440CZUU,,Baby Products,
B00440CZVE,"Vital Baby 5 Pack Soft Tip Baby's 1st Spoons, Pink",Baby Products,$9.95
B00440CZW8,"Vital Baby Baby's 1st Feeding Set, Pink",Baby Products,$13.99
B00440CZXM,"Vital Baby Unbelievabowl Set, Orange",Baby Products,$15.14
B00440CZZU,,Baby Products,
B00440D00E,,Baby Products,
B00440D018,,Baby Products,
B00440D022,,Baby Products,
B0044BE66U,Sassy Transitional Feeding Spoons 4+ months (pack of 4 spoons) BPA Free,Baby Products,
B0044DN8SA,,Baby Products,
B0044MURW6,3pk - Clay Hanging Keepsake Baby Prints Kit,Baby Products,
B0044R7G5M,"Keekaroo Height Right High Chair, Infant Insert and Tray Combo, Natural/Cherry",Baby Products,$229.99
B0044R7HYM,,Baby Products,
B0044R7I00,"Keekaroo Height Right High Chair with Tray, Natural",Baby Products,$189.95
B0044TTRAM,,Baby Products,
B0044TZELS,EIO Kids Cup Cap & Sleeve (Glass Jar Is Not Included) (Green),Baby Products,
B0044UJEAO,"Kids Line Velour Changing Pad Cover, Mosaic Transport (Discontinued by Manufacturer)",Baby Products,
B0044V7P2C,Tiddliwinks Noah's Ark Monkey Security Blanket,Baby Products,
B00450SPSA,Petunia Pickle Bottom Wistful Weekender (Rambling Rose),Baby Products,
B00451ACTO,"South Shore Angel 4 Drawer Chest, Espresso",Baby Products,$126.69
B00451ACV2,"South Shore Angel Changing Table, Espresso",Baby Products,$151.65
B0045508QC,,Baby Products,
B00456O466,"Medela Quick Clean Micro-Steam Bags, 5 Count",Baby Products,
B00457X7D6,,Baby Products,
B00457X7DG,"Boppy EntertainMe Play Gym, Flying Circus (Discontinued by Manufacturer)",Baby Products,
B00457X7E0,"Boppy Tummy Play Pad, Stripe A Dot (Discontinued by Manufacturer)",Baby Products,
B0045I6IA4,,Baby Products,
B0045I9H5M,,Baby Products,
B0045JKUU2,Fisher-Price Rainforest Healthy Care High Chair,Baby Products,
B0045OW4LA,"Sassy Teething Feeder, Boy, Blue/Green (Discontinued by Manufacturer)",Baby Products,$9.65
B0045VA3SO,,Baby Products,
B0045Y140M,"Harmony Kids Standard Rocker, Hot Pink (Discontinued by Manufacturer)",Baby Products,
B0045Y15AQ,"Harmony Kids Round Back Glider, Blue Chenille",Baby Products,
B0045Y1F4W,"Englacha Plastic Board Rider, Black",Baby Products,$72.00
B00465QRTS,"Itzy Ritzy WBL8024 Travel Happens Sealed Wet Bag, Avocado Damask, Large, Travel Happens, Large (Discontinued by Manufacturer)",Baby Products,
B00466H20K,"Hold-On Handles Bizzy Bugs Single Handle Set, Butterfly",Baby Products,
B00466H25A,"Hold-On Handles Bizzy Bugs Spare Handle Unit, Ladybug",Baby Products,
B00466YF9G,Picky Sticky Baby Photo Monthly Onesie Stickers (Boy O Boy),Baby Products,
B0046CASUK,12x16 Toddler Pillow (Playful Monkey),Baby Products,$21.95
B0046MV58Y,Sassy Rock and Roll Ring Stacker,Baby Products,$16.44
B0046N26YU,"Snorepin Anti Snoring Aid Sleep Device, Silicone",Baby Products,
B0046Q8218,,Baby Products,
B0046QDV32,Joovy Room2 Ultralight Playard Black (Discontinued by Manufacturer) (Discontinued by Manufacturer),Baby Products,
B0046S4N5A,Prince Lionheart bebePOD Upgrade Tray,Baby Products,$9.52
B00474AT6K,,Baby Products,
B00474BM66,"NuAngel Washable Nursing Pads  100% Cotton  8 Pads  Extra Soft, Comfortable, Absorbent",Baby Products,$9.99
B00474CUTO,Boppy Prenatal Sleep Wedge (Discontinued by Manufacturer),Baby Products,
B00475SE2A,BabyComfyNose Nasal Aspirator Crystal | #1 Tested Snot Sucker,Baby Products,
B00477M1UE,,Baby Products,
B00477ND0Q,,Baby Products,
B00478UG46,,Baby Products,
B0047BJ2LQ,Petunia Pickle Bottom Touring Tote Diaper Bag (Afternoon in Aberdeen),Baby Products,
B0047DOE5S,"Skip Hop Reversible Plush Blanket, Alphabet Zoo",Baby Products,
B0047EASLG,,Baby Products,
B0047EBM9I,"Skip Hop Baby Insulated 14-piece Bento Clix Mealtime Travel Kit, 3 Microwaveable Containers, Black",Baby Products,$24.99
B0047GNVQS,,Baby Products,
B0047O2C3S,"Satsuma Designs Organic Wash Cloths and Wipes 5 Pack, White",Baby Products,$16.00
B0047O3Y26,"Britax Parkway SGL Booster Seat, Cardinal (Prior Model)",Baby Products,
B0047PAHUW,WubbaNub Elephant Pacifier,Baby Products,$14.95
B0047RARG4,Tommee Tippee Closer to Nature Newborn Starter Set,Baby Products,
B0047RI5YU,,Baby Products,
B0047WGOLQ,,Baby Products,
B0047XZ8SK,,Baby Products,
B0047ZG8SM,"Kissa's One Size All-In-One Diaper, Chocolate",Baby Products,$24.00
B00483GAJU,"GroVia BioLiners Unscented Diaper Liners, 200 Count",Baby Products,
B00487USOE,,Baby Products,
B00488TF38,The Art of Cure Original Premium Certified Baltic Amber Teething Necklace (Cherry) - Lab Tested 12.5 Inches,Baby Products,$16.89
B0048BP5RU,Dr. Brown's Gia Nursing Pillow,Baby Products,$29.99
B0048NDAH0,,Baby Products,
B0048NT8UI,,Baby Products,
B0048SOBGO,"Baby Bottle Labels, Self-laminating - Great for Daycare",Baby Products,
B004919TPS,,Baby Products,
B00494CKIS,Infantino Tag Along Chimes Frog and Duck,Baby Products,$11.99
B00494DNZC,"Philips Avent BPA Free Classic Polypropylene Bottle, Pink, 9 Ounce, 3 Count (Discontinued by Manufacturer)",Baby Products,$21.95
B00499CGV4,"Pearhead Wooden Giraffe Piggy Bank, Yellow",Baby Products,$27.26
B00499CNWQ,,Baby Products,
B00499CO70,"Ju-Ju-Be Classic Collection Be Neat Reversible Bib, Shadow Waltz",Baby Products,$29.99
B00499DRZI,"Sealy Sweet Pea 2-in-1 Maternity and Nursing Pillow, Cappuccino (Discontinued by Manufacturer)",Baby Products,
B00499DU1O,"Kolcraft Wonderbug Activity Center, Bugging Around (Discontinued by Manufacturer)",Baby Products,
B0049B3TD6,LilyPadz Reusable Silicone Nursing Pads Starter Kit Single Pair Regular Size,Baby Products,$36.95
B0049E1KQG,"Summer Infant 2 Pack Microfleece Swaddleme, Green",Baby Products,
B0049HAO2O,"American Baby Company Heavenly Soft Minky Dot Fitted Contoured Changing Pad Cover, Blue Puff",Baby Products,$7.65
B0049JLNWW,Tommee Tippee Electric Steam Sterilizer,Baby Products,
B0049M9OY8,Babymoon Pod - For Flat Head Syndrome & Neck Support (Baby Blue),Baby Products,$28.00
B0049NYYJ2,"Boppy Nursing Pillow and Positioner, Luxe Monkey Chevron",Baby Products,
B0049NYYQK,,Baby Products,
B0049O0YWC,"JJ Cole Car Seat Canopy, Aqua Drops (Discontinued by Manufacturer) (Discontinued by Manufacturer)",Baby Products,
B0049O1228,,Baby Products,
B0049OO3F6,,Baby Products,
B0049PE8HS,juDanzy rainbow polka dot baby & toddler leg warmers,Baby Products,$7.50
B0049SP08Q,Bright Starts Bright Starts Take n' Shake Stroller Toys,Baby Products,$5.30
B0049SP0AE,,Baby Products,
B0049SP0CC,,Baby Products,
B0049U1VQ4,Adjustable Belt for Toddlers and Babies - Dapper Snappers Toddler Belt - Tan,Baby Products,
B0049U5UAM,"Badger Basket Five Basket Storage Unit with Wicker Baskets, Espresso",Baby Products,$116.94
B0049U5UCU,"Badger Basket Moses Basket with Polka Dot Hood and Bedding, Espresso/Brown",Baby Products,$40.99
B0049U5UEI,,Baby Products,
B0049U5UG6,"Badger Basket Three Bin Storage Cubby, Blue",Baby Products,$76.99
B0049XD9C0,Prince Lionheart Stove Guard,Baby Products,$20.99
B0049YS46K,"Lifefactory Glass Baby Bottles 4 Pack (9 oz. in Ocean, Sky, Orange, Royal Purple)",Baby Products,$67.00
B0049ZOEA4,Sassy Teething Tail Fish,Baby Products,$6.31
B004A15YSI,"Graco Stanton Convertible Crib, Classic Cherry (Discontinued by Manufacturer)",Baby Products,$213.32
B004A5BRR6,Leachco Easy Teether XL - Crib Rail Cover For Convertible Cribs - Sage,Baby Products,
B004A5I6QQ,,Baby Products,
B004A8ZS1E,"Babykicks 3G Pocket Diaper, White/Multicolored Snaps (Discontinued by Manufacturer)",Baby Products,
B004A910UG,,Baby Products,
B004A9Q4OI,Playmaker Toys Turtle Family Bath Sets(set of 4) - Floating Bath Tub Toy,Baby Products,$7.26
B004A9ZF3Y,"Mumi&Bubi Solids Starter Kit, Baby Food Freezer Storage Trays",Baby Products,$24.89
B004AAIQ1G,,Baby Products,
B004AC8M4K,Sassy Rock Star Guitar Musical Toy,Baby Products,
B004AE3DJW,"ReUsies Snack and Sandwich Reusable Bag Set, Purple",Baby Products,$16.00
B004AGP5LY,,Baby Products,
B004AHKUHM,,Baby Products,
B004AHKUHW,Graco Secure Coverage Digital Baby Monitor with 2 Parent Units,Baby Products,
B004AHMCD2,"Safety 1st Contour Baby Changing Pad with Non-Skid Bottom and Safety Strap, Water Resistant, White",Baby Products,
B004AHMCKA,Sassy Wonder Wheel Activity Center,Baby Products,$7.79
B004AHMCKK,,Baby Products,
B004AHMCKU,Sassy Jitter Bugs Toy,Baby Products,
B004AHMCL4,"Sassy 2 Piece Wrist Rattles Set, Styles May Vary",Baby Products,$13.99
B004AHMCLY,,Baby Products,
