Product_ID,Product_Name,Domain,Product_Price
097293751X,"Baby Tracker® - Daily Childcare Journal, Schedule Log",Baby Products,$17.95
9729375011,"Baby Tracker for Newborns - Round-the-Clock Childcare Journal, Schedule Log",Baby Products,$15.95
B00000IZQI,Fisher Price Nesting Action Vehicles,Baby Products,
B00000J3LL,My Quiet Book for Toddlers by Pockets of Learning,Baby Products,$29.50
B00002JV9S,The First Years Massaging Action Teether,Baby Products,$9.11
B00002JXFI,Soft Teething Beads,Baby Products,
B000034DCJ,Crown Crafts The Original NoJo BabySling by Dr. Sears - Denim (Discontinued by Manufacturer),Baby Products,
B00003TKWE,Arm's Reach Original Co-sleeper 100% Cotton White Sheet (Discontinued by Manufacturer),Baby Products,
B00003TL3H,Sassy Busy Bugs Bar (Discontinued by Manufacturer),Baby Products,$15.37
B00003TL7P,Baby Trend Diaper Champ (Discontinued by Manufacturer),Baby Products,
B00003XAKP,"Summer Infant Ultimate Crib Sheet, 52"" x 28""",Baby Products,$19.99
B00003XAKR,"Summer Infant, Ultimate Training Pad - Twin Mattress, 52"" x 28""",Baby Products,$12.95
B000046S2U,Odorless Diaper Pail by Safety 1st,Baby Products,
B000046S3T,Safety 1st Double-Touch Plug 'N Outlet Covers,Baby Products,$5.42
B000046S3W,Safety 1st Power Strip Cover,Baby Products,$7.99
B0000482F9,Safety 1st Blind Cord Wind Ups,Baby Products,$1.99
B0000482FN,Safety 1St/Dorel Oven Lock 241 Child Safety,Baby Products,$5.05
B0000488W1,"Safety 1st Magnetic Locking System Starter Set (2 Locks, 1 Key)",Baby Products,$14.98
B0000488W2,Safety 1st Magnetic Tot Lok Complete Set,Baby Products,$17.98
B00004C8S8,Safety 1st Hospital's Choice Fold Up Nail Clippers,Baby Products,$7.98
B00004C8S9,Safety 1st Digital Pacifier Thermometer,Baby Products,
B00004D3ES,Safety 1st Space Saver Fold-Up Bath Tub,Baby Products,
B00004D3EU,Safety 1st Deluxe 4-in-1 Bath Station,Baby Products,
B00004RA66,NORTH STATE IND 8666 Grey 6 Panel Play Gate,Baby Products,$59.00
B00004TFLB,Munchkin Mozart Magic Cube,Baby Products,
B00004TIHX,"Sesame Street Potty Soft Seat, Elmo",Baby Products,
B00004W1UB,Gund Baby Tinkle Crinkle Rattle Toy,Baby Products,$12.95
B00004YMZE,Evenflo Top of Stair Gate (Discontinued by Manufacturer),Baby Products,
B00004YT3U,"Animal Planet's Big Tub of Dinosaurs, 40+ Piece Set",Baby Products,$24.97
B00005610Y,Graco Tot Wheels V Mobile Entertainer Center,Baby Products,
B000056C86,"Graco Pack 'N Play Playard Totbloc with Carry Bag, Bugs Quilt",Baby Products,
B000056HM5,Playtex Drop-Ins Original BPA Free Nurser Newborn Starter Set (Discontinued by Manufacturer),Baby Products,
B000056HM8,Gerber 12-Pack Prefold Birdseye 3-Ply Cloth Diapers with Padding - White (Discontinued by Manufacturer),Baby Products,
B000056HMB,"The First Years Night Cravings Bottle Warmer & Cooler, Blue/White",Baby Products,$28.29
B000056HMV,Single Deluxe Breastpump by Medela 67272 67272,Baby Products,
B000056HMX,Kidco G80 Configuregate - For Irregular Openings,Baby Products,
B000056HMY,The First Years Nature Sensations Lullaby Player (Discontinued by Manufacturer),Baby Products,
B000056HND,Cosco 10-T58-WHO Portable Crib White (Discontinued by Manufacturer),Baby Products,
B000056HNM,Delta Children's Products Vintage Chic Jenny Lind Changing Table in Oak (Discontinued by Manufacturer),Baby Products,
B000056HNO,Terry Contoured Changing Pad Cover - Ecru,Baby Products,$19.99
B000056HNU,Avent ISIS Breast Pump with Disposable Nurser,Baby Products,
B000056HNV,UltraSoft Quilted Crib Mattress Pad,Baby Products,
B000056HNX,Philips Avent 3 Pack 9oz Bottles (Discontinued by Manufacturer),Baby Products,
B000056HNZ,Philips AVENT Isis On The Go Set (Discontinued by Manufacturer),Baby Products,
B000056J1C,Mommy's Helper Drain 'N Dry Bottle Drying Rack,Baby Products,$7.95
B000056J1W,Prince Lionheart Table Edge Guard with 4 Corners,Baby Products,$19.99
B000056J1X,100% Cotton Terry Contour Changing Pad Cover - Lavender,Baby Products,
B000056J23,Stroller Connectors,Baby Products,$18.95
B000056J2D,Cooshie Booster & Travel Bag - Blue,Baby Products,
B000056J39,Prince Lionheart Jumbo Corner Guards,Baby Products,$11.49
B000056J6T,The First Years - Crib CD Player (Discontinued by Manufacturer) (Discontinued by Manufacturer),Baby Products,
B000056J76,BABYBJORN Toilet Trainer - White/Red,Baby Products,$26.99
B000056J78,BABYBJORN Little Potty - Red,Baby Products,
B000056J7K,"BABYBJORN Potty Chair, Blue",Baby Products,$22.66
B000056J8N,Gerber 12-Pack Flatfold Birdseye Cloth Diapers - White (Discontinued by Manufacturer),Baby Products,
B000056J90,Medela Breastmilk Storage and Feeding Set,Baby Products,
B000056J9F,"Kid-ding Quilted Waterproof Multi-Use Pad - 27"" x 36""",Baby Products,
B000056JAK,Playtex Sipster Cup 9 oz - 2 Pack (Colors Vary) (Discontinued by Manufacturer),Baby Products,
B000056JAZ,Philips AVENT Breast Milk Storage (Discontinued by Manufacturer),Baby Products,
B000056JB8,"Kel-Gar Snug-Tub - Elephant Supersize 32"" x 21""",Baby Products,
B000056JC1,Dexbaby Pregnancy Pillow,Baby Products,
B000056JCC,Double Headrest for Newborns & Infants,Baby Products,
B000056JCY,The Original Baby Safe Feeder (Pack of One),Baby Products,
B000056JEG,Medela CSF Bags - Economy 50 Pack,Baby Products,
B000056JHP,Sunshine Kids Mighty Tite (Discontinued by Manufacturer),Baby Products,$43.39
B000056JHX,Graco Pack 'n Play Sheet Navy,Baby Products,
B000056JIE,"Medela 100% Cotton Washable Bra Pads, 4 Count",Baby Products,
B000056JIH,Medela Nursing Stool,Baby Products,
B000056JJ8,Prince Lionheart Crib Rail Protector (Discontinued by Manufacturer),Baby Products,
B000056JJF,Mommy's Helper Power Strip Safety Cover,Baby Products,$5.92
B000056JKR,Delta Children's Products Jenny Lind Changing Table in White,Baby Products,
B000056JLK,Terry Contoured Changing Pad Cover - Blue,Baby Products,
B000056JMU,"Playtex Baby Nurser Drop-Ins Baby Bottle Disposable Liners, Closer to Breastfeeding, 8 Ounce - 100 Count",Baby Products,$4.22
B000056JNO,Peewees Disposable Multi-Use Pads - 36 Pack,Baby Products,
B000056OUF,Philips AVENT Express Baby Food and Bottle Warmer (Discontinued by Manufacturer),Baby Products,
B000056OUG,,Baby Products,
B000056OUH,Philips AVENT Express Microwave Sterilizer (Discontinued by Manufacturer),Baby Products,
B000056OUO,Prince Lionheart Diaper Depot Clear,Baby Products,
B000056OUX,"Safety 1st Kids Safety Railnet for Indoor Balconies and Outdoor Decks, Extends up to 10', White",Baby Products,$14.99
B000056OV0,"PRIMO EuroBath, Pearl White",Baby Products,$24.99
B000056OV3,Playtex Diaper Genie - First Refill Included,Baby Products,
B000056OVS,Prince Lionheart Fireplace Guard with Two Corners,Baby Products,$29.11
B000056OWB,Terry Contoured Changing Pad Cover - White,Baby Products,
B000056OWT,"Safety 1st Crystal Clear Baby Monitor, White",Baby Products,$34.09
B000056W4V,"Evenflo 3 Pack Classic Glass Bottle, 4-Ounce",Baby Products,
B000056W4X,Quilted Crib Mattress Pad,Baby Products,
B000056W65,Playtex BPA Free Drop-Ins Orthodontic Latex Nipple - 2 Pack (Discontinued by Manufacturer),Baby Products,
B000056W6F,"Philips Avent Classic Newborn Flow Nipple, 2-Pack",Baby Products,$3.60
B000056W7R,Safety 1st Furniture Wall Straps 2 Count,Baby Products,$4.99
B000058CC7,The First Years Hands Free Gate (Discontinued by Manufacturer),Baby Products,
B000058DI5,The First Years Pooh Pacifier Attacher (Discontinued by Manufacturer),Baby Products,$6.99
B000058DJL,"KidCo Gateway Pressure-Mounted 37""Gate, White",Baby Products,$59.95
B000058DLV,Baby Bjorn Baby Carrier - Navy,Baby Products,
B000058DM5,BABYBJÖRN Navy Carrier,Baby Products,
B000058DN6,BABYBJORN Step Stool  Blue,Baby Products,$24.30
B000058DN9,"Philips AVENT Soft Spout Magic Cup, 9 Ounce, Twin, Color May Vary (Discontinued by Manufacturer)",Baby Products,
B000058DNE,Bugs On Board (Discontinued by Manufacturer),Baby Products,$27.97
B000058DPL,Medela 12 Volt Vehicle Lighter Adaptor,Baby Products,$28.49
B000058DPM,Medela SoftShells for Inverted Nipples,Baby Products,
B000058DPN,Medela SoftShells for Sore Nipples,Baby Products,
B000058DQA,Baby B'Air Toddler Flight Vest - Red,Baby Products,$22.95
B000058DQJ,"Philips Avent Comfort Breast Shell Set, 2 Count",Baby Products,$16.99
B000059XOD,BABYBJORN Original Carrier - City Black (Discontinued by Manufacturer),Baby Products,
B000059XP6,The First Years Essentials Care Kit,Baby Products,
B00005AWB7,Especially for Baby Roller Shade,Baby Products,$5.50
B00005BLBP,"Learning Curve Meal Mates Colored Soft Bite Spoons, 5 Pack (Discontinued by Manufacturer)",Baby Products,
B00005BLM6,Dr. Brown's Natural Flow Bottle Starter Kit (Discontinued by Manufacturer),Baby Products,
B00005BMAL,"Philips AVENT BPA Free Nipple Protector, Standard",Baby Products,$5.40
B00005BMDX,"Playtex 3 Pack VentAire Standard Bottles, 9 Ounce (Colors may vary) (Discontinued by Manufacturer)",Baby Products,
B00005BOTS,"Leachco Rock N Soft Cushioned Nursing Stool, Ivory",Baby Products,$40.95
B00005BPK5,JJ Cole Premaxx Sling Carrier - New Edition Red Orange (Discontinued by Manufacturer),Baby Products,
B00005BQ4N,Lady Bug Comb Brush Set,Baby Products,$26.84
B00005BQ4O,Philips AVENT Non Spill Soft Spouts (Discontinued by Manufacturer),Baby Products,$23.97
B00005BSAC,"Playtex Spill-proof Cup Replacement Valves - 4 Pack, 4 Count",Baby Products,$6.74
B00005BSM3,Tubside Kneeler & Step Stool,Baby Products,
B00005BSXI,Safety 1st 900 Mhz Sight And Sound Nursery Monitor System,Baby Products,
B00005BT37,"Summer Infant Snuzzler Infant Support for Car Seats and Strollers, Ivory",Baby Products,$12.38
B00005BTB1,Night & Day Bottle Warmer,Baby Products,
B00005BTC5,Playtex BPA Free Drop-Ins NaturaLatch Latex Nipple - Fast Flow - 2 Pack (Discontinued by Manufacturer),Baby Products,$46.80
B00005BTNA,"Playtex Baby Ventaire Anti Colic Baby Bottle, BPA Free, 9 Ounce - 3 Count",Baby Products,$7.92
B00005BU51,"Baby Buddy Size-It Closet Organizers, Blue",Baby Products,$3.59
B00005BUMY,Take & Toss Infant Spoons - 16 pack,Baby Products,$2.98
B00005BX4W,Baby In Sight Mirror (Discontinued by Manufacturer),Baby Products,$21.99
B00005BX4Z,Prince Lionheart Stove Guard,Baby Products,$27.93
B00005BXEY,Philips AVENT BPA Free Standard Breast Pump Conversion Kit,Baby Products,
B00005BXI9,Car Seat Undermat,Baby Products,
B00005BXKM,"The First Years Quick Serve Bottle Warmer,Colors May Vary",Baby Products,$15.48
B00005BYUJ,Prince Lionheart Formula Mixer (Discontinued by Manufacturer),Baby Products,
B00005BYUR,"Dr. Brown's Original Bottle, 4 Ounce, 3-Pack",Baby Products,$17.99
B00005BYUS,"Dr. Brown's Natural Flow Y-Cut Standard Nipple, 3 Pack (Discontinued by Manufacturer)",Baby Products,
B00005BYUX,"Nuby 9-Piece Fork and Spoon Travel Set, Colors May Vary",Baby Products,$7.83
B00005C0EN,"Evenflo Classic Nipples, Slow Flow 0-3 months (pack of 4)",Baby Products,
B00005C0KD,"Gerber First Essentials Soft Center Latex Pacifier in Assorted Colors, 0-6 Months (Discontinued by Manufacturer)",Baby Products,
B00005C0PO,"Gerber First Essential 6 Pack Silicone Nipples, Fast Flow",Baby Products,$4.16
B00005C1HC,Philips AVENT BPA Free Classic Dome Caps,Baby Products,$5.49
B00005C1JP,Safety 1st Finger Pinch Guard,Baby Products,$4.55
B00005C1TG,"Playtex BPA Free Disposable Nurser Liners 8 oz, 140-Count (Discontinued by Manufacturer)",Baby Products,
B00005C1WK,Safety 1st Bi-Fold Door Lock,Baby Products,$4.36
B00005C2NP,DEX Automobile Baby Bottle Warmer,Baby Products,
B00005C5H4,The First Years Stacking Up Cups,Baby Products,$3.19
B00005C5XX,Press N Pull Plug Protectors,Baby Products,$42.00
B00005C6OI,"Dr. Brown's Original Bottle, 8 Ounce, 3-Pack",Baby Products,
B00005C6P4,dexbaby Dex Baby Food Processor Top Loading,Baby Products,$34.73
B00005CAJK,"Badger Basket Barrel Top Toy Box, Natural",Baby Products,$86.23
B00005CARW,"Playtex Baby Nurser Drop-Ins Baby Bottle Disposable Liners, Closer to Breastfeeding, 4 Ounce - 50 Count",Baby Products,
B00005CBBF,NoJo Wall Decor,Baby Products,$19.30
B00005CFA8,Leachco Bath 'N Bumper - Cushioned Bath Tub - Blue Fish,Baby Products,
B00005JIVI,"Leachco Safer Bather Infant Bath Pad, Blue Fish",Baby Products,$19.99
B00005LBZF,BABYBJORN Plate and Spoon - Blue,Baby Products,
B00005MKYI,Deluxe Music In Motion Developmental Mobile W Remote (Discontinued by Manufacturer),Baby Products,
B00005N9X5,The First Years On-The-Go Booster Seat (Discontinued by Manufacturer),Baby Products,
B00005N9X8,The First Years Hands Free Gate Extension (Discontinued by Manufacturer) (Discontinued by Manufacturer),Baby Products,
B00005NCAW,Infantino Cozy Rider,Baby Products,
B00005QBW7,"Philips AVENT Hard Spout Magic Trainer with Handle, 9 Ounce, Twin (Colors May Vary) (Discontinued by Manufacturer)",Baby Products,
B00005QBWZ,Especially for Baby Wipe Warmer with bonus Diaper Organizer,Baby Products,
B00005QBXC,Safety 1st: Rockin' Jitter Buggy,Baby Products,
B00005QSKC,The First Years Take & Toss Spill-Proof 7 Ounce Cups 6 ea Assorted Colors,Baby Products,$5.69
B00005QXPE,Safety 1st On-the-Go Fold-Up Booster Seat,Baby Products,
B00005RCS1,"Pearhead Babyprints Keepsake Wall Frame, White (Discontinued by Manufacturer)",Baby Products,
B00005RH5J,Eddie Bauer Backpack - Navy,Baby Products,
B00005TNIH,Fisher-Price Sounds'n Lights Monitor,Baby Products,
B00005TZJJ,Safety 1st All in One Child Care Kit,Baby Products,$51.18
B00005U8T5,"Safety 1st Deluxe Press Fit Outlet Plugs, 8 Count",Baby Products,$8.45
B00005UC6D,Summer Infant Complete Nursery Care Kit (Discontinued by Manufacturer),Baby Products,$20.89
B00005UC6Q,Philips AVENT Magic Trainer Handles (Discontinued by Manufacturer),Baby Products,$22.99
B00005V5MU,Malden International Designs Nursery Parade Baby Metal Picture Frame,Baby Products,$17.99
B00005V6C8,Dekor Diaper Plus Diaper Disposal System,Baby Products,$56.93
B00005V95L,Lamaze: Pupsqueak the Puppy,Baby Products,
B00005V9NV,"Philips AVENT Disposable Nursing Pads, 100-Count (Discontinued by Manufacturer)",Baby Products,$29.99
B00005Y1VE,"KidCo Soft Jamb Door Stop, White, 3 count",Baby Products,
B00005YVRM,,Baby Products,
B00005YWN0,Baby's Quiet Sounds Video Monitor (Discontinued by Manufacturer),Baby Products,
B00005YXVW,Eddie Bauer Car Seat Travel Bag,Baby Products,$34.99
B00005YYE3,"Playtex Sipsters Stage 3 Spill-Proof, Leak-Proof, Break-Proof Insulated Spout Sippy Cups - 9 Ounce - 2 Pack (Color and Design May Vary)",Baby Products,
B0000630KW,Tiny Love Take Along Arch -Tropical,Baby Products,
B0000634T0,Ecru Folding Hamper,Baby Products,
B0000635WI,"Leachco Snoogle Total Body Pillow, Ivory",Baby Products,$59.00
B000063XV4,"Philips AVENT Washable Nursing Pads, 6-Count",Baby Products,$6.50
B00006408K,Prince Lionheart Dresser Top Diaper Depot,Baby Products,
B0000645D7,The First Years - Natural Comfort Breastpump,Baby Products,
B0000645DP,"Peace of Mind Two 900 Mhz Baby Receivers, Monitor",Baby Products,
B0000646RF,,Baby Products,
B0000649E1,Kushies 5 Pack Reusable Ultra Diapers for Infants,Baby Products,
B0000649E5,"Kushies Washable Pre-folded Diapers, White",Baby Products,$21.16
B000066665,Munchkin White Hot Inflatable Duck Tub,Baby Products,$11.99
B000066CMV,Philips AVENT Isis Manual Breast Pump (Discontinued by Manufacturer),Baby Products,
B000067BIZ,,Baby Products,
B000067EH7,"The First Years Sure Comfort Deluxe Newborn To Toddler Tub, Blue",Baby Products,$19.99
B000067PIZ,"Sassy Baby Powdered Formula Dispenser, Colors May Vary (Discontinued by Manufacturer)",Baby Products,
B000067PPZ,"Medela Contact Nipple Shield, X-Small",Baby Products,$7.35
B000067PQ0,"Medela Contact Nipple Shield, Medium",Baby Products,
B000067PRC,"Kiddopotamus Tinydiner Placemat, Yellow (Discontinued by Manufacturer)",Baby Products,$15.99
B000067Q6J,"KidCo Baby Steps Food Mill, 1 food mill (Discontinued by Manufacturer)",Baby Products,$23.88
B000067Q6K,Sliding Door Locks,Baby Products,$7.99
B000067Q6S,KidCo Toilet Lock - White,Baby Products,
B000067QMD,Philips AVENT BPA Free Classic Bottle Sealing Discs,Baby Products,$4.49
B000067QMJ,Fisher-Price Royal Potty (Discontinued by Manufacturer),Baby Products,
B000067QZI,Sassy Baby's First Toys,Baby Products,
B000068OJ5,"Neat Solutions Sesame Street Table Topper Disposable Stick-in-Place Placemats, 50-Count",Baby Products,
B000068P9S,Toysmith Battat Ready Set Go Cars Toy,Baby Products,
B000068QH6,"Leachco Cuddle-U Basic Nursing Pillow and More, Pink Pin Dot",Baby Products,$39.99
B00006966I,Playtex VentAire Advanced Standard Bottle Gift Set (Discontinued by Manufacturer),Baby Products,
B000069EXN,"HALO SleepSack Micro-Fleece Wearable Blanket, Soft Pink, Small",Baby Products,
B000069RAO,Boppy Luxe - Clouds,Baby Products,
B00006AKYN,Munchkin Teething Blanket with Pacifier Attachment (Discontinued by Manufacturer),Baby Products,
B00006C29H,,Baby Products,
B00006FWVR,"Medela Disposable Nursing Bra Pads, 60 Count",Baby Products,
B00006G963,Tiny Love Symphony-in-Motion Remote Mobile,Baby Products,
B00006G9LI,"KidCo Baby Steps Food Mill, 1 food mill (Discontinued by Manufacturer)",Baby Products,$23.88
B00006JZEN,Tiny Love Double-Sided First Book,Baby Products,$15.59
B00006JZHD,Colorado Tote,Baby Products,
B00006S3RX,Evenflo Portable Ultrasaucer,Baby Products,
B00006ZCCE,Boppy - Tummy Play,Baby Products,
B00006ZCCF,"Boppy Luxe Slipcover, Pink",Baby Products,
B000071OVQ,Malawi - 6 Piece Bedding Set.,Baby Products,
B000071OVV,Koala Baby Chambray Hamper - Light Blue,Baby Products,
B0000789S0,,Baby Products,
B0000789SZ,FISHER PRICE SINGING STAR GYM by Mattel,Baby Products,
B0000789TD,,Baby Products,
B0000789TL,Disney Pooh - Mobile,Baby Products,
B0000798KZ,The First Years Simple & Secure Stair Gate,Baby Products,
B0000798L0,The First Years Sit and Store Parent Bathing Seat and Stepstool,Baby Products,
B00007B769,Rest Assured,Baby Products,
B00007B76C,Inclined to Sleep,Baby Products,
B00007C65S,Munchkin Deluxe Bottle And Food Warmer With Pacifier Cleaning Basket,Baby Products,
B00007DWBH,"Graco SnugRide Classic Connect Infant Car Seat Base, Silver",Baby Products,
B00007DWDZ,Evenflo Comfort Select Auto-Cycling Breast Pump (Discontinued by Manufacturer),Baby Products,
B00007E9C9,"Burlington Baby Large White Willow Basket Set with Liner, Pink (Discontinued by Manufacturer)",Baby Products,
B00007E9CC,"Burlington Baby White Willow Hamper with Liner, Blue (Discontinued by Manufacturer)",Baby Products,
B00007E9CG,Pooh Bundles Tote (Discontinued by Manufacturer),Baby Products,
B00007H1YR,Long-Range Vibrating Baby Monitor,Baby Products,
B00007L11C,Mother's Touch Deluxe Baby Bather,Baby Products,
B00007LB17,"Pearhead Babyprints Desk Frame, Mahogany (Discontinued by Manufacturer)",Baby Products,$56.01
B00007LP11,Peg Perego Primo Viaggio Car Seat / Infant Carrier with LATCH Base - Black Sable,Baby Products,
B000083GHY,"Prince Lionheart 2 Stage Seatsaver, Black",Baby Products,$21.99
B000083JTJ,Knit Double Headrest - Navy (Discontinued by Manufacturer),Baby Products,
B000083JV8,Mid City Tote - Diaper Bag,Baby Products,
B00008439C,DEX Products Sound Sleeper SS-01,Baby Products,
B00008614F,Playtex Premium Nurser Newborn Gift Set (Discontinued by Manufacturer),Baby Products,
B000088KGZ,Safety 1st Hospital's Choice 8 Second Digital Thermometer,Baby Products,
B0000899O3,First Years Premium Single Electric Pump,Baby Products,
B00008CQLS,Koala Baby - Moonbeam 6 Piece Bedding Set,Baby Products,
B00008CQLV,Madison Avenue Baby Musical Mobile,Baby Products,
B00008GYD0,The First Years - Easy Comfort Manual Breast Pump (Discontinued by Manufacturer),Baby Products,
B00008KWO1,"HALO SleepSack 100% Cotton Wearable Blanket, Soft Pink, Small",Baby Products,$19.73
B00008ODBG,Prince Lionheart Ultimate Wipes Warmer --the only anti-microbial warmers,Baby Products,
B00008X35T,Dreamscapes Soother,Baby Products,
B00008XL2W,Snap 'N Go - Infant Car Seat Carrier,Baby Products,
B00008YSRN,Dr. Brown's Deluxe Wide Neck Bottle Starter Kit - 3 pack (Discontinued by Manufacturer),Baby Products,
B0000936LR,Baby Einstein Seek & Discover Activity Gym (Discontinued by Manufacturer),Baby Products,
B0000936M4,"Dr. Brown's 8 oz. Natural Flow Wide Neck Bottle, 3 Pack (Discontinued by Manufacturer)",Baby Products,
B000095S69,Gerber Bare Basics Gift Set,Baby Products,
B000096L4F,Crown Crafts The Original NoJo BabySling by Dr. Sears - Black Chambray (Discontinued by Manufacturer),Baby Products,
B000096LVC,Sassy Counting and Spell Bath Appliques (Discontinued by Manufacturer),Baby Products,$10.90
B000096LWJ,"Playtex Sipsters Stage 1 Spill-Proof, Leak-Proof, Break-Proof Soft Spout Sippy Cup - 6 ounce - 1 Count (Color May Vary)",Baby Products,$4.90
B000096LWX,Parent Units DVD Guard,Baby Products,$12.95
B000096M2Z,"Take & Toss Toddler Bowls with Lids - 8oz, 6 pack",Baby Products,$3.35
B000096M59,,Baby Products,
B000096M5Y,"Gerber Breast Pads - Variety Pack, 100-Count",Baby Products,
B000096NQU,Medela Pump In Style Traveler Breast Pump,Baby Products,
B000096ONW,"Prince Lionheart Dishwasher Basket, Infant",Baby Products,$8.21
B000096PG0,The First Years - Lanolin Disposable Breast Pads 30 ct. (Discontinued by Manufacturer),Baby Products,
B000096QK4,"Dr. Brown's Natural Flow Preemie Standard Nipple, 3 Pack (Discontinued by Manufacturer)",Baby Products,
B000096QQ3,"Dr. Brown's Natural Flow Level 3 Standard Nipple, 3 Pack (Discontinued by Manufacturer)",Baby Products,$5.50
B000098XG2,Simmons Kids 100% Terry Cotton Contour Changing Pad Cover - Green (Discontinued by Manufacturer),Baby Products,
B000099Z9K,,Baby Products,
B00009IMCK,Munchkin Twisty Figure 8 Teether,Baby Products,$5.29
B00009K2YU,"Boppy Noggin Next Head Support, Denim (Discontinued by Manufacturer)",Baby Products,
B00009KWYH,Barn Yard - 6 Piece Set,Baby Products,
B00009KX5K,Green Chambray Folding Hamper,Baby Products,
B00009KX73,Infantino Matching Colors and Textures Puzzles (Discontinued by Manufacturer),Baby Products,
B00009LWL9,Wonderworld Twist 'N' Roll,Baby Products,$14.99
B00009LZNI,All Stars 6 Piece Crib Bedding Set,Baby Products,$149.89
B00009NQQO,ALEX Toys Rub a Dub Hoops for the Tub,Baby Products,$9.89
B00009P7I5,Safety 1st Safe-Glow Nursery Monitor 2 Receiver Set,Baby Products,
B00009Q6G6,Arms Reach Co-Sleeper brand Mini Co-Sleeper Bassinet - Natural,Baby Products,
B00009QMQV,Sassy Caterpillar Mobile With Suction Arm (Discontinued by Manufacturer),Baby Products,
B00009RGSX,Sassy Soft Sided Toy Organizer (Discontinued by Manufacturer),Baby Products,
B00009VE5O,"JJ Cole Original Infant Bundle Me, Graphite",Baby Products,$50.59
B00009VE6W,The Ultimate Baby Wrap in Navy,Baby Products,
B00009X3Y7,Snugli Front and Backpack - Carrier (Discontinued by Manufacturer),Baby Products,
B00009ZIKH,Manhattan Toy Wimmer-Ferguson Infant Stim-Mobile for Cribs (Discontinued by manufacturer),Baby Products,
B0000A1O7P,"Regalo Easy Diner Portable Hook On Highchair, Navy",Baby Products,$39.99
B0000A1OEX,Trend Lab Pique Diaper Stacker in White,Baby Products,$19.18
B0000A1OEZ,Trend Lab Pique Toy Bag in White,Baby Products,$11.95
B0000A340G,"JJ Cole Original Infant Bundleme, Navy (Discontinued by Manufacturer)",Baby Products,
B0000A340I,"JJ Cole Original Toddler Bundleme, Navy (Discontinued by Manufacturer)",Baby Products,
B0000ALEVA,Prince Lionheart Complete Dishwasher Basket System,Baby Products,$15.99
B0000AY9XV,Jumpster Doorway Jumper - Jackpot,Baby Products,
B0000AY9XY,Philips AVENT Newborn Starter Set (Discontinued by Manufacturer),Baby Products,$70.70
B0000AY9Y0,Philips AVENT Infant Feeding Set,Baby Products,
B0000BX8LV,The First Years Take & Toss Straw Sippers (4-Pack),Baby Products,
B0000CARJQ,,Baby Products,
B0000CBGBR,Fisher Price Soothing Massage Bouncer,Baby Products,
B0000CBGBS,Fisher-Price Baby Papasan (Discontinued by Manufacturer) (Discontinued by Manufacturer),Baby Products,
B0000CBGBT,Fisher Price - Aquarium Take-along Swing,Baby Products,
B0000CED7N,"Philips AVENT Magic Sport Spouts, 18+ Months (Discontinued by Manufacturer)",Baby Products,
B0000D14PW,"JJ Cole Infant Original Bundleme, Pink",Baby Products,
B0000D9RQ2,,Baby Products,
B0000D9SR8,,Baby Products,
B0000D9SRG,Summer Infant Newborn-To-Toddler Bath Center & Shower (Discontinued by Manufacturer),Baby Products,$58.32
B0000D9SS4,Microwave Steam Sterilizer,Baby Products,$14.99
B0000DBHHR,The First Years Everywhere Gate (Discontinued by Manufacturer),Baby Products,
B0000DEW8N,"Fisher-Price Healthy Care Booster Seat, Blue/Green/White",Baby Products,$34.99
B0000DEW8Y,900mhz Attachable Monitor,Baby Products,
B0000DEW91,"Summer Infant Multi-Use Extra Tall Walk-Thru Gate, White",Baby Products,$44.92
B0000DEWAZ,Black Diaper Bag,Baby Products,
B0000DEWH6,"Badger Basket Natural Moses Basket with Hood, Blue Waffle Bedding",Baby Products,$49.99
B0000DH5TU,Sound N Lights Monitor with Dual Receivers,Baby Products,
B0000DH5TX,Fisher-Price: 49 MHz Sounds 'n Lights Monitor,Baby Products,
B0000E2DIE,Kidkusion Kid Safe Banister Guard,Baby Products,$32.23
B0000E3D8L,SafeFit Baby In Sight (Discontinued by Manufacturer),Baby Products,
B0000TYHCS,Playtex Drop-Ins NaturaLatch Silicone Nipple - Variable Flow Y-Cut - 2 Pack,Baby Products,
B0000TYHD2,Playtex Embrace Breast Pump System (Discontinued by Manufacturer),Baby Products,
B0000VSBYQ,"Playtex VentAire Advanced Wide Natural Shape Slow-Flow Nipples, 2 Count (Discontinued by Manufacturer)",Baby Products,$10.00
B0000YGM9Y,"Tiny Love Musical Stack and Ball Game, Orange Elephant",Baby Products,
B00012BSEY,"Tiny Love Fruity Pals, Anna Banana",Baby Products,
B00012CHFI,"The First Years Close And Secure Sleeper,Colors May Vary",Baby Products,$29.98
B00012YSU0,Cloth Diaper Doublers,Baby Products,$9.00
B000134XZE,Citrus Circles Diaper Pail Deodorizing Disks,Baby Products,$7.99
B000136O8S,OsoCozy Cloth Baby Wipes - 15 ct,Baby Products,$9.95
B00014PLAO,Kidkusion Gummi Crib Rail,Baby Products,$9.75
B00014PLGS,"Sassy Teething Feeder, Colors May Vary (Discontinued by Manufacturer)",Baby Products,$5.50
B00016BPA2,Pump In Style Advanced Breastpump,Baby Products,
B00018XCJC,Prince Lionheart Complete Drying Station,Baby Products,$11.99
B00018XCLU,Dex Products Travel Wipes Warmer,Baby Products,$49.99
