Product_ID,Product_Name,Domain,Product_Price
B001CB7I4W,"Carter's Keep Me Dry Fitted Quilted 4-Ply Crib Pad, White (Discontinued by Manufacturer)",Baby Products,$23.99
B001CB8K26,B kids Yo Gabba Gabba Musical Boombox,Baby Products,
B001CC88AE,"Ju-Ju-Be Be Quick Wristlet, Brown/Champagne",Baby Products,
B001CCBG7Q,"Dream On Me Liberty Collection 3 Drawer Changing Table, Cherry",Baby Products,$197.81
B001CCWJ72,"MAM Night Orthodontic Pacifier, Girl, 0-6 Plus Months, 2-Count",Baby Products,$5.99
B001CDFPY0,"Boppy Changing Pad Liners, White, 3 Count",Baby Products,$7.59
B001CFFX90,Changing Lifestyles Safe-er-Grip Foot Rest,Baby Products,$7.97
B001CH2X5K,"The First Years 3-in-1 Kickin Coaster Seat, Green/Yellow (Discontinued by Manufacturer)",Baby Products,
B001CJKE40,"Ju-Ju-Be Paci Pod Pacifier Holder, Lilac Lace",Baby Products,
B001CKBK42,Kushies Kid Size Dupont Rubber Sunglasses with Polycarbonate Lenses,Baby Products,$7.95 - $9.95
B001CKBL5A,Kushies Toddler Sunglasses - Anti-Uv Lens Block(colors may vary),Baby Products,
B001CKYN5A,"Gerber Brand 6 Pack Prefold Birdseye Organic Diaper, White (Discontinued by Manufacturer)",Baby Products,
B001COIH3A,Philips AVENT Basic Baby Monitor with DECT Technology (Discontinued by Manufacturer),Baby Products,
B001COPE86,Philips AVENT Digital Screen Baby Monitor with DECT Technology (Discontinued by Manufacturer),Baby Products,
B001CPD400,"Natursutten BPA-Free Chill-It Teether, Sea Star, 3-12 Months",Baby Products,
B001CSMD3Q,Fisher-Price Link-a-Doos 20 Link Pack,Baby Products,$11.29
B001CSO1FO,"Jeep Wrangler Twin Sport All-Weather Umbrella Stroller, Fierce (Discontinued by Manufacturer)",Baby Products,
B001CSZ0VS,The First Years American Red Cross Soothing Baby Scale,Baby Products,
B001CUPT3K,"J is for Jeep Travel System Weather Shield, Baby Rain Cover, Universal Size to fit most Travel Systems, Waterproof, Windproof, Ventilation, , Protection, Shade, Umbrella, Pram, Vinyl, Clear, Plastic",Baby Products,$10.99
B001CUPT76,"J is for Jeep Deluxe Stroller Weather Shield, Baby Rain Cover, Universal Size, Waterproof, Water Resistant, Windproof, See Thru, Ventilation, Protection, Shade, Umbrella, Pram, Vinyl, Clear, Plastic",Baby Products,$12.99
B001CV13RA,"J is for Jeep Double Stroller Rain Cover, Tandem Stroller Rain Cover, Baby Rain Cover, Double Stroller Accessories, Tandem Stroller Weather Shield, Universal Size, Waterproof, Windproof",Baby Products,$17.65
B001CVX68E,"Delta Children Portable Mini Crib, Cherry",Baby Products,$100.00
B001CW7CVK,"Cloud b Twilight Constellation Night Light, Lady Bug",Baby Products,$29.99
B001CWAVJ0,Boon Frog Pod Suction Cup Bracket (Discontinued by Manufacturer),Baby Products,
B001CWB3J2,"Carters Easy Fit Sateen Crib Fitted Sheet, Ecru (Discontinued by Manufacturer)",Baby Products,$7.49
B001CWB3KG,"Carters Easy Fit Velour Crib Fitted Sheet, Ecru (Discontinued by Manufacturer)",Baby Products,
B001CWB3LA,"Carters Easy Fit Jersey Cradle Fitted Sheet, Blue (Discontinued by Manufacturer)",Baby Products,
B001CWBKW2,"Safety 1st Spring n' Release Latches, 10 Pack",Baby Products,$4.77
B001CWD75A,"Carters Super Soft Bumper, Pink (Discontinued by Manufacturer)",Baby Products,
B001CWDCO6,"Carters Easy Fit Jersey Crib Fitted Sheet, Pink (Discontinued by Manufacturer)",Baby Products,
B001CWDCY6,"Carters Easy Fit Jersey Bassinet Fitted Sheet, White (Discontinued by Manufacturer)",Baby Products,
B001CWEXWQ,"DwellStudio Baby Squares Fitted Crib Sheet, Dove Grey",Baby Products,$34.99
B001CWF01O,"Carters Easy Fit Jersey Portable Crib Fitted Sheet, White (Discontinued by Manufacturer)",Baby Products,$5.84
B001CWFBR2,"Carter's 4 Pack Wrap Me Up Receiving Blanket, Pink Cheetah (Discontinued by Manufacturer)",Baby Products,$12.69
B001CWFCV2,"Carter's Easy Fit Printed Crib Fitted Sheet, Animal (Discontinued by Manufacturer)",Baby Products,
B001CWGXE2,Philips Avent Breast Pump Conversion Kit,Baby Products,
B001CWVYMI,"J is for Jeep Car Seat Travel Bag, Universal Size Car Seat Cover, Fits All Car Seats, Shoulder Strap Included, For Airport Gate Check-In, Infant and Baby Carrier Travel Bag, Black, Nylon",Baby Products,$19.13
B001D12RLK,"Stokke Tripp Trapp Chair, Red",Baby Products,$249.00
B001D1307U,"Stokke Tripp Trapp Baby Set, Black",Baby Products,
B001D16V1M,"Carters Super Cozy Striped Blanket, Sage",Baby Products,
B001D17F5S,"Stokke Tripp Trapp Cushion, Beige Stripes",Baby Products,$44.00
B001D1B5OK,"Carters Everyday Easy Blanket, Pink",Baby Products,$29.99
B001D20K40,"Leachco Easy Teether XL Convertible Crib Rail Cover, Ivory",Baby Products,$34.45
B001D2WX5E,"Nuby Non-Drip Wide Neck Bottle, 10 Ounce, Colors May Vary",Baby Products,$13.25
B001D446XE,"HALO Early Walker SleepSack Lightweight Knit Wearable Blanket, Blue, Medium (Discontinued by Manufacturer)",Baby Products,$15.99
B001D458EA,"HALO SleepSack Applique Micro-Fleece Wearable Blanket, Blue Dog, Small",Baby Products,
B001D475FU,Dr. Brown's Microwave Steam Sterilizer,Baby Products,$24.49
B001D72NLS,,Baby Products,
B001D7E0WS,"HALO SleepSack 100% Cotton Swaddle, Soft Pink, Newborn",Baby Products,$22.63
B001D7FZCW,"HALO Big Kids SleepSack Lightweight Knit Wearable Blanket, Blue, 2-3T",Baby Products,$21.05
B001D7JOCY,"Munchkin Mighty Grip Straw Cup, 10 Ounce, Colors May Vary (Discontinued by Manufacturer)",Baby Products,
B001D7KNYW,"The First Years Take & Toss Toddler Flatware, 16 Piece",Baby Products,$2.29
B001DDMFI8,"Naturepedic Waterproof Fitted Crib Pad, 28x52",Baby Products,$69.00
B001DDMFK6,"Naturepedic Waterproof Flat Portacrib Pad, 24x38",Baby Products,$39.00
B001DDRXJE,"Naturepedic Waterproof Flat Bassinet Oval Pad, 14x29",Baby Products,$29.00
B001DDXWVC,"Summer Infant Sure and Secure Double Bedrail, Blue (Discontinued by Manufacturer)",Baby Products,
B001DEGURY,"Prince Lionheart BoosterPOD, White Base/Lemon (Discontinued by Manufacturer) (Discontinued by Manufacturer)",Baby Products,
B001DF4OQ2,"SafeFit By My Side Harness with Backpack, Black/Blue(Light and Dark)/Grey (Discontinued by Manufacturer)",Baby Products,
B001DF67GC,SafeFit Kick Mats 2-Pack in Black (Discontinued by Manufacturer),Baby Products,
B001DF67I0,SafeFit Jumbo Mirror (Discontinued by Manufacturer),Baby Products,
B001DJ6AWY,Malden Baby Album Expressions in Pink,Baby Products,
B001DKHPD6,"Ju-Ju-Be Be All Diaper Bag, Lotus Lullaby",Baby Products,$79.99
B001DLJVPA,Boon Flair Highchair - Orange Pad - White Base,Baby Products,$229.99
B001DLNAHU,"Dream On Me Liberty 5-in-1 Convertible Crib, Black",Baby Products,$132.25
B001DMTAIW,Tadpoles Organic Cotton Pin-Stripe Kimono-Style Bodysuit,Baby Products,$12.99 - $19.21
B001DNJBDK,Leachco Easy Teether XL - Crib Rail Cover For Convertible Cribs - White,Baby Products,
B001DRGOQ8,"Swaddlebees Diaper Wet Bags, Butterflies",Baby Products,$16.95
B001DTB1J6,"Bright Starts Chime Along Friends Take-Along Toys-Styles Will Vary Assortment of 3, Each Sold Separately",Baby Products,$5.99
B001DVRTEA,,Baby Products,
B001DWG32S,"Tadpoles Organic Cotton Double Layer Receiving Blanket, Cocoa",Baby Products,$13.49
B001DWG3V4,"Munchkin Portable Diaper Caddy, Colors May Vary (Discontinued by Manufacturer)",Baby Products,$20.22
B001DZX1HK,Once Upon A Potty Plush Doll Set With Mini-Potty - Girl,Baby Products,$15.00
B001E1J1WC,"Thermos Funtainer 12 Ounce Bottle, Disney Princesses",Baby Products,$15.99
B001E4GO9C,Bum Bum Balm (30g) Brand: Dimpleskins Naturals,Baby Products,$19.00
B001E4VTD8,"Sealy Naturals Cotton Fitted Crib/Toddler Mattress Pad Cover - 100% Cotton Fabric & Fill, Hypoallergenic, 300 Thread Count, Machine Washable & Dryer Friendly 52x28 (White)",Baby Products,$29.99
B001E5BZF4,"Peekaru Original Fleece Baby Carrier Cover, Medium- Brown",Baby Products,$71.00
B001E5CDUK,"Britax Boulevard 65 CS Click & Safe Convertible Car Seat, Cowmooflage",Baby Products,
B001E5NDAE,,Baby Products,
B001E8R46U,"Dr. Brown's BPA Free Polypropylene Natural Flow Standard Neck Bottle, 4 oz - 3-Pack (Discontinued by Manufacturer)",Baby Products,
B001ECHXVC,Little Partners Learning Tower Kids Adjustable Height Kitchen Step Stool for Toddlers or Any Little Helper - Natural,Baby Products,$199.99
B001EH4W6G,"Snappi Cloth Diaper Fasteners - Pack of 3 (Light Blue, Bright Blue, White)",Baby Products,$12.99
B001ELYAG4,Diaper Dekor Plus Pail,Baby Products,$60.61
B001EMMKUG,"Under The Nile Pull Over Bib, Ice Blue Snail (Discontinued by Manufacturer)",Baby Products,$9.99
B001EN494K,Kushies Zolo Mobilo,Baby Products,$21.93
B001ENY02G,"Jolly Jumper Rocking Moses Basket Stand, Expresso",Baby Products,$46.25
B001EQ66WK,"The Shrunks Toddler Travel Bed Portable Inflatable Air Mattress Bed for Travel or Home Use, White, Toddler Size with Security Rails 60 x 37 x 9 inches",Baby Products,$63.97
B001ETWU4U,"MOBI TykeLight Best Portable kids Night Light with smart timer for baby's room, a night time buddy & travel companion with Dimmer, Green",Baby Products,$8.95
B001EU35BQ,"Peg-Perego Prima Pappa Best High Chair, Paloma",Baby Products,$249.99
B001EU4ZF6,MobiCam Audio Video Baby Monitoring System (Discontinued by Manufacturer),Baby Products,
B001EU7MPQ,Boon Catch Bowl With Spill Catcher Blue/Orange,Baby Products,$6.03
B001EU8IPY,Medela Breast Milk Feeding Gift Set,Baby Products,
B001EVG8HS,"Thinkbaby Baby Bottle to Sippy Cup Conversion/Replacement Kit, Orange, 9 Months",Baby Products,$7.62
B001EX81ZI,Philips AVENT BPA Free Classic Bottle Sealing Discs,Baby Products,$4.49
B001EYXFBM,"C.R. Gibson First Year Calendar, ABC and Me",Baby Products,
B001EYYQ6U,"C.R. Gibson Grandma's Brag Book, Zoom Zoom (Discontinued by Manufacturer)",Baby Products,$29.98
B001F0RAB6,Playtex Standard BPA Free Disposable Nurser Liners 4 oz - 100 Count (Discontinued by Manufacturer),Baby Products,$14.99
B001F0RAC0,Playtex Drop-Ins Original BPA Free Nurser 8 oz - 1 Pack - Colors Vary (Discontinued by Manufacturer),Baby Products,
B001F2692K,Sippy Cup,Baby Products,
B001F37M6Q,Edushape Floating Blocks,Baby Products,$19.99
B001F3YJNA,"Kushies Nursing Pillow, Cream Polka Dots",Baby Products,
B001F41S6K,"Arm's Reach Co-Sleeper Mini Bassinet, Tan Gingham (Discontinued by Manufacturer)",Baby Products,
B001F43JTO,WubbaNub Yellow Duck Pacifier,Baby Products,$13.95
B001F50FFE,"Evenflo 6 Pack Classic Glass Bottle, 4-Ounce",Baby Products,$33.95
B001F50FFO,"Evenflo 3 Pack Classic Glass Bottle, 8-Ounce - 2 Packs of 3 Bottles",Baby Products,$16.95
B001F8TLLU,"Baby Briefcase Baby Paperwork Organizer, Mint/Periwinkle",Baby Products,$22.21
B001F913N8,"Tilty Sippy Cup, Clear, 7 Ounce, 2 Pack",Baby Products,
B001FA0CN4,"Badger Basket Sleigh Style Changing Table with Hamper/3 Baskets, White",Baby Products,$129.98
B001FA0CPW,"Badger Basket Natural Baby Moses Basket with Hood Bedding, Blue Gingham",Baby Products,$43.94
B001FB567U,Levana BABYVIEW20 Interference Free Digital Wireless Video Baby Monitor with Night Light Lullaby Camera,Baby Products,
B001FB5BFW,"Safety 1st Alpha Omega Elite Convertible Car Seat, Triton",Baby Products,$89.99
B001FBFIF0,Munchkin Traveling Flash Cards,Baby Products,$39.95
B001FBK440,"Malden International Designs Mirrored Glass With Mirrored Inner Border Godmother Picture Frame, 4x6, White",Baby Products,$14.99
B001FCK32C,"Sealy Stain Protection Waterproof Fitted Crib/Toddler Mattress Pad Cover Protector -100% Waterproof Layer, Hypoallergenic, Deep Fitted Skirt, Machine Washable & Dryer Friendly 52x28 (White)",Baby Products,
B001FCM24E,,Baby Products,
B001FD167C,"Safety 1st Sit, Snack and Go Booster",Baby Products,
B001FD4VNI,Safety 1st Prograde Lever Handle Lock - 1 Pack,Baby Products,
B001FGL9X0,WubbaNub Brown Puppy Pacifier,Baby Products,$13.95
B001FL42VG,"Nuby No-Spill Flip-It Cup with Kwik-Flo Valve, 14 Ounce, Colors May Vary",Baby Products,
B001FOCO4K,Sealy Perfect Rest Mattress (Discontinued by Manufacturer),Baby Products,$79.99
B001FOEQ46,"Sealy Baby Posturepedic Crown Jewel Infant/Toddler Crib Mattress -220 PostureTech Sensory Coils, Orthopedically Designed Coils, Hospital-Grade Waterproof Cover, EverEdge System, 52""x28""",Baby Products,$119.60
B001FOGIZQ,"Sealy Baby Posturepedic Infant/Toddler Crib Mattress -220 PostureTech Sensory Coils, Orthopedically Designed Coil System, Hospital-Grade Waterproof Cover, Secure Edges, Anti-Sag System, 52""x28""",Baby Products,$101.12
B001FSEDL8,"Philips AVENT BPA Free Insulated Cup, 9 Ounce, Colors and Design May Vary (Discontinued by Manufacturer)",Baby Products,$1.99
B001FSHJFU,"Philips AVENT ISIS iQ Uno Electric Breast Pump, White (Discontinued by Manufacturer)",Baby Products,
B001FSL3NO,"Philips AVENT BPA Free ISIS iQ Duo Twin Electric Breast Pump, White (Discontinued by Manufacturer)",Baby Products,
B001FT19IW,"Lambs and Ivy Enchanted Forest Hamper, Green (Discontinued by Manufacturer)",Baby Products,
B001FT2NYQ,"Lambs & Ivy Enchanted Forest 6 Pc Baby Crib Bedding Set, Green (Discontinued by Manufacturer) (Discontinued by Manufacturer)",Baby Products,
B001FVGM6O,,Baby Products,
B001FVIJ4M,Battat Sort and Stack Toy,Baby Products,$14.68
B001FW3UHW,Milo The Monkey Pacifier Holder,Baby Products,
B001FWY1H0,Trumpette Howdy Cow Kids Inflatable Bouncy Rubber Hopper Ride-On Toy White,Baby Products,$37.37
B001FXE2XC,"Ulubulu Expression Pacifier Set, Unisex, Pull to Sound Alarm and Mute Button, 0-6 Months",Baby Products,$13.08
B001G0XWAI,Natura Organic Baby/Toddler Cloud Pillow,Baby Products,
B001G2IAT4,,Baby Products,
B001G2K2BI,Philips AVENT BPA Free Infant Bottle Starter Set (Discontinued by Manufacturer),Baby Products,
B001G2K2BS,Philips AVENT BPA Free Essentials Gift Set with Sterilizer (Discontinued by Manufacturer),Baby Products,$95.53
B001G3SDXQ,"The First Years Soothie Newborn (0-3 months) Pacifiers, Girl (Discontinued by Manufacturer)",Baby Products,
B001G3XFSY,Manhattan Toy Skwinkle Teether and Rattle Activity Clutching Toy,Baby Products,$14.99
B001G4RWG4,"The First Years Breastflow Starter Set,Blue",Baby Products,$20.97
B001G4TMUI,"The First Years Soothing Breast Wipes, 30 Count",Baby Products,$7.99
B001G4VBQ6,"The First Years Lanolin Free Nipple Butter, 2 Ounce",Baby Products,$5.24
B001G4VFHG,"The First Years 1 Pack Breastflow Bottle, 9 Ounce",Baby Products,$5.43
B001G4YULO,The First Years Gumdrop Pacifier Wipes,Baby Products,$4.99
B001G6L5BA,"Baby Buddy Bear Pacifier Holder, Blue",Baby Products,$4.99
B001G87KYE,Starter Supplemental Nursing System with 80ml Bottle,Baby Products,$17.92
B001GAQEG2,,Baby Products,
B001GBMDUW,"Lambs and Ivy Enchanted Forest Wall Appliques, Green",Baby Products,
B001GGOWZ6,"Baby Buddy Shopping Cart Safety Belt, Navy",Baby Products,$4.99
B001GHZ2L8,Kidswitch Light Switch Extender- 3 Pack,Baby Products,$16.99
B001GI4FXI,Kids Shampoo Rinse Cup SRC44,Baby Products,
B001GMO8SQ,Dreambaby Cable Lock,Baby Products,$9.29
B001GMQADC,"Quinny Zapp 2009/2010 4 Wheel Stroller, Citro",Baby Products,
B001GPBJP8,"StrollAway Over the Door Stroller Storage Hanger, White",Baby Products,
B001GPIMEY,Sesame Street Meal and Play Mat,Baby Products,$9.99
B001GQ2P6O,,Baby Products,
B001GQ2P78,"Graco Sweet Slumber Sound Machine, White",Baby Products,
B001GQ2P82,"Graco Cozy Dinette Highchair, Broadstreet",Baby Products,
B001GQ2P96,"Graco Modern Pack 'N Play Playard with Bassinet and Changer, Zurich (Discontinued by Manufacturer)",Baby Products,
B001GQ2PN2,,Baby Products,
B001GQ2RUS,Fisher-Price My Little Lamb Infant Seat,Baby Products,
B001GQ2RV2,Fisher-Price Precious Planet Deluxe Musical Activity Gym (Discontinued by Manufacturer),Baby Products,
B001GQ2RVC,Fisher-Price Precious Planet Snow Globe and Lights Bouncer (Discontinued by Manufacturer),Baby Products,
B001GQ2RVW,Fisher-Price Precious Planet Happy Giraffe Bouncer (Discontinued by Manufacturer) (Discontinued by Manufacturer),Baby Products,
B001GQ2RW6,Fisher-Price Precious Planet Froggy Friend Potty,Baby Products,
B001GQ2RWG,Fisher-Price Cheer for Me Potty (Discontinued by Manufacturer),Baby Products,$69.99
B001GQ2RX0,Fisher-Price Precious Planet Hop On Hippo Step Stool (Discontinued by Manufacturer),Baby Products,
B001GQ2RXK,Fisher-Price Precious Planet Healthy Care Booster (Discontinued by Manufacturer),Baby Products,
B001GQ2RZ8,Fisher-Price Precious Planet Open Top Take-Along Swing (Discontinued by Manufacturer),Baby Products,
B001GQ2RZI,Fisher-Price Precious Planet Jumperoo (Discontinued by Manufacturer) (Discontinued by Manufacturer),Baby Products,
B001GQ2SA2,Fisher-Price Precious Planet 2-in-1 Projection Mobile,Baby Products,$59.99
B001GRTMVE,"SwaddleDesigns Marquisette Swaddling Blanket, Premium Cotton Muslin, Kiwi Mod Circles",Baby Products,$9.99
B001GRTMVO,"SwaddleDesigns Marquisette Swaddling Blanket, Premium Cotton Muslin, Pink Striped Fish",Baby Products,$13.76
B001GRX3PK,"SwaddleDesigns Marquisette Swaddling Blanket, Premium Cotton Muslin, Brown Mod Circles on Pastel Pink",Baby Products,$13.11
B001GSS6FG,Sassy Baby's First Toy 6 Piece Gift Set (Discontinued by Manufacturer),Baby Products,
B001GUTYYQ,Lamaze Clip & Go Princess Sophie,Baby Products,
B001GZK184,"BABYBJORN Baby Carrier Original - Green, Spirit (Discontinued by Manufacturer)",Baby Products,
B001H07HR6,"Bright Starts Bounce Bounce Baby Activity Zone, Neutral",Baby Products,
B001H0GEXO,,Baby Products,
B001H0GF0G,Evenflo BabyGo High Chair - Red (Discontinued by Manufacturer),Baby Products,
B001H0GF0Q,Evenflo BabyGo Glide Baby Carrier Animal Toss (Discontinued by Manufacturer),Baby Products,$15.00
B001H0GF10,Evenflo ExerSaucer Triple Fun - Jungle (Discontinued by Manufacturer),Baby Products,
B001H0GF1K,Evenflo In the Garden Walk Around ExerSaucer (Discontinued by Manufacturer),Baby Products,
B001H0GF24,Evenflo Summit Pressure Mounted Metal Gate (Discontinued by Manufacturer),Baby Products,$74.73
B001H0GF2O,Evenflo Crosstown Soft Portable Travel Gate (Discontinued by Manufacturer),Baby Products,
B001H0GGMS,"Evenflo Big Kid AMP No Back Booster Car Seat, Red (Discontinued by Manufacturer)",Baby Products,
B001H0GGTQ,Evenflo Farmyard Mega ExerSaucer (Discontinued by Manufacturer),Baby Products,
B001H0GGUK,"Evenflo SmartSteps Jump and Go, ABC123 (Discontinued by Manufacturer)",Baby Products,
B001H0GGWS,"Evenflo COuncey 3 Pack Glass Bottle with Sleeve, 8 Ounce, Colors May Vary (Discontinued by Manufacturer)",Baby Products,
B001H1AC0Y,"Ameda CustomFit Breast Flanges, Medium/Large",Baby Products,$17.00
B001H39FPK,"The First Years Soothie Newborn Pacifiers, Boy (Discontinued by Manufacturer)",Baby Products,
B001H3AQE4,Naturepedic Organic Cotton Changing Pad Cover,Baby Products,$29.00
B001H86JRC,"Munchkin Baby Gate Extension, White, 2.75""",Baby Products,
B001H9NXCA,Sassy Harmonization Fascination Station Suction Toy (Discontinued by Manufacturer),Baby Products,
B001H9NXEI,,Baby Products,
B001H9NXFW,Sassy Earth Brights Wooden Dove Toy (Discontinued by Manufacturer),Baby Products,
B001H9NXJ8,"Sassy Seat Doorway Jumper, 5 Toys",Baby Products,
B001H9NXLG,Sassy Illumination Station Suction Toy (Discontinued by Manufacturer),Baby Products,
B001HDCYYO,Contours Tandem Car Seat Attachment (Older Version) (Discontinued by Manufacturer),Baby Products,$23.95
B001HJTTWS,"Bambino Mio, Miofresh (Diaper/Laundry Cleanser), 26 oz",Baby Products,$16.70
B001HKPHYQ,Mobi TykeLight Portable GloMate (Discontinued by Manufacturer),Baby Products,
B001HO48M4,"Easy Teether XL Crib Rail Cover, Organic",Baby Products,$29.99
B001HTG0NO,The Heavenly Stroller,Baby Products,
B001HU2LDQ,"Thirsties Diaper Cover, Aqua, X-Small (6-12 lbs)",Baby Products,
B001HWYLNM,"UPPAbaby G-Luxe Stroller, Navy Harrison (Discontinued by Manufacturer)",Baby Products,
B001HX4D4I,,Baby Products,
B001HX4DN4,BABYBJORN BabySitter Balance Air - White Mesh (Discontinued by Manufacturer),Baby Products,
B001HX4DNE,BABYBJORN Fitted Sheet for Travel Crib Light - Organic White,Baby Products,$24.95
B001HZCHO4,BABYBJORN Wooden Toy for Bouncer - Googly Eyes,Baby Products,$38.76
B001I3OE3C,"The Original Woombie Baby Cocoon Swaddle, Newborn Short, Kiwi Green",Baby Products,
B001I459AS,"Philips Avent Orthodontic Translucent Silicone Pacifier, 6-18 Months 2 ea (Colors May Vary)",Baby Products,$4.50
B001I45F70,"Starting Small Monkey Novelty Hamper in Brown, 18 x 11 x 24",Baby Products,$9.99
B001I45F8Y,Munchkin Bobble Bee Suction Toy,Baby Products,
B001I45IK4,Lamaze Play and Grow Kerry the Fairy Take Along Toy (Discontinued by Manufacturer),Baby Products,
B001I463G2,Joovy Room2 Portable Playard,Baby Products,$194.27
B001I481LM,,Baby Products,
B001I7TCQC,"UPPAbaby Vista Stroller, Green Carlin (Discontinued by Manufacturer)",Baby Products,
B001IA2XGK,"ImseVimse  Premium Baby Washcloths Wipes  in Soft Thin Reusable Natural Organic Cotton for Sensitive Skin  Perfect for baby care, bath, face cleansing for newborns, toddlers, adults (set 12)",Baby Products,$14.95
B001IA7VL2,"Imse Vimse Sanitary pads 3 pcs, Organic Regular",Baby Products,$18.95
B001IC5XDI,Snuza Hero Mobile Baby Movement Monitor,Baby Products,
B001IDBH28,Zoli Baby Breath Electric Nasal Aspirator (Discontinued by Manufacturer),Baby Products,$32.96
B001IDQ2TQ,ZoLi On-the-Go Formula and Snack Dispenser,Baby Products,$14.60
B001IDYCA2,Sassy Bathtime Fun Appliques - 84 Piece Set (Discontinued by Manufacturer),Baby Products,
B001IEJKSK,Tiny Love Gymini Kick N Discover Activity Gym,Baby Products,
B001IJ4N00,"Boon Bug Pod Bath Toy Scoop,Red (Discontinued by Manufacturer)",Baby Products,$46.97
B001IP8NTG,Sealy Baby Ultra Rest Mattress (Discontinued by Manufacturer),Baby Products,$109.99
B001IS17F0,"C.R. Gibson Grandma's Brag Book, 10 Sheets/20 Pages, Measures 4.5"" x 7"" - Jack",Baby Products,$19.99
B001ISJW66,"Moby Wrap Prints 100% Cotton Baby Carrier, Dots (Discontinued by Manufacturer)",Baby Products,
B001IUTYXU,,Baby Products,
B001IXYOD2,Dr. Brown's Original Bottle Newborn Feeding Set,Baby Products,$23.74
B001IY2SPW,"J is for Jeep Baby Playpen Mosquito Netting, Universal Size, Pack N Play Mosquito Net Tent, Play Yard Kid Insect Mesh Cover, White",Baby Products,$7.95
B001IY4MUQ,"Jeep Crib Net, Crib Netting, Baby Crib Net, Crib Mosquito Net, Crib Netting Mosquito, Baby Bed Mosquito Net Tent, Kid Insect Mesh Cover, Universal Size, White",Baby Products,$7.99
B001IYD6VM,"J is for Jeep Mosquito Net for Strollers, Mosquito Net for Car Seat and Infant Carrier, Universal Size, Bug Cover, Weather Protection, White",Baby Products,$4.89
B001IYIQS0,,Baby Products,
B001IYISSS,"phil&teds Highpod Highchair, Black (Discontinued by Manufacturer)",Baby Products,
B001IYQ7QS,"Jeep Floor Mat, Plastic Play Mat, Waterproof High Chair Floor Protector, Splat Mat, Multi-Purpose Playmat for Playing and Feeding, Clear, 50 Inches Diameter",Baby Products,$12.10
B001J28IW0,Munchkin Bath Dunkers Toy Set,Baby Products,$9.61
B001J2QGBA,KidCO 2 Count Door Knob Lock,Baby Products,$6.58
B001J5ZWKI,"Lambs and Ivy Enchanted Forest Musical Mobile, Green",Baby Products,$44.99
B001J8JOAY,"Safety 1st Summit Booster Car Seat, Rachel",Baby Products,$85.76
B001JA85K2,Medela Symphony Breast Pump,Baby Products,
B001JD7TH4,Sealy Naturalis Crib Mattress with Organic Cotton (Discontinued by Manufacturer),Baby Products,
B001JDGO7A,"Skip Hop Little Kid & Toddler Mate Feeding Divided Plate & Utensil (Spoon + Fork) Mealtime Set, Blue / White",Baby Products,$29.99
B001JDL2YU,"GEENNY 13 Piece Crib Bedding Set, Brown/Blue Star and Moon",Baby Products,$100.12
B001JDMVD6,"Skip Hop Hare Brush and Comb Set, White/Orange",Baby Products,
B001JEOG3I,"Edushape See-Me Sensory Ball, 7 Inch, Colors May Vary",Baby Products,$9.99
B001JEOGWE,,Baby Products,
B001JHSTS8,Philips AVENT Twin Pack Nipplette,Baby Products,$27.10
B001JJCMJ8,"Lambs and Ivy Enchanted Forest Plush Owl, Green",Baby Products,
B001JKFK0U,Beco Baby Butterfly II ORGANIC Carrier In Espresso,Baby Products,
B001JKU7AI,BEST FRIEND NECKLACES,Baby Products,
B001JNS8V0,Kissaluvs One Size Hybrid Diapers 6Pack COLORS (7-35lbs) - Boy,Baby Products,
B001JQLCOM,My Little Seat Travel High Chair - Seaside Stripes,Baby Products,$24.99
B001JQMGBU,"Bright Starts Bounce-A-Bout Activity Center, Neutral (Discontinued by Manufacturer)",Baby Products,
B001JSZE62,"Safety 1st Prograde Toilet Lock, White and Silver - 1 Pack",Baby Products,
B001JT1QN6,,Baby Products,
B001JT34IQ,"Playtex 3 Pack BPA Free Ventaire Crystal Clear Standard Bottles, 9 Ounce (Discontinued by Manufacturer)",Baby Products,
B001JTLEUQ,,Baby Products,
B001JZU8O8,Boppy Changing Pad (Changing Pad Set Mod Circles - Tan),Baby Products,$17.99
B001KC08TU,,Baby Products,
B001KEDIUO,"green sprouts Organic Cotton Nursing Pads, White (Discontinued by Manufacturer)",Baby Products,
B001KJL0S6,"Bebe Au Lait Burp Cloth Set 3-Pack, Papillon (Discontinued by Manufacturer)",Baby Products,$20.00
B001KK6I8M,Wubbanub Infant Pacifier - Red Dog,Baby Products,$14.95
B001KQFYBS,green sprouts Natural Wood Cage Rattle (Discontinued by Manufacturer),Baby Products,
B001KSHAU4,,Baby Products,
B001KXDL5C,"KidKusion off white Table Cushion, Off White",Baby Products,$12.66
B001KXGI9S,"Kidkusion Jumbo Edge Kushion, Black",Baby Products,$22.68
B001KYA0GO,"Sugarbooger Children's Closet Dividers, Pink Dots",Baby Products,$13.64
B001KYD9BM,,Baby Products,
B001KYSBCO,"Gerber Graduates BPA Free 2 Pack Divide N' Dine Plate, Colors May Vary (Discontinued by Manufacturer)",Baby Products,
B001KYUEWE,"Sassy No Scratch Bottle Brush, Colors May Vary (Discontinued by Manufacturer)",Baby Products,$12.00
B001KZH67Y,"American Baby Company Velour Fitted Pack N Play Playard Sheet made with Organic Cotton, Natural Color",Baby Products,$39.99
B001KZH68S,"American Baby Company Knit Fitted Portable/Mini-Crib Sheet made with Organic Cotton, Natural Color",Baby Products,$7.98
B001KZH692,"American Baby Company Knit Fitted Pack N Play Playard Sheet made with Organic Cotton, Natural Color",Baby Products,$11.09
B001KZH69M,"American Baby Company Waterproof Quilted Fitted Portable/Mini Crib pad cover made with Organic Cotton, Natural Color",Baby Products,$18.19
B001KZH69W,"American Baby Company Waterproof Quilted Multi-Use Pad Cover made with Organic Cotton, Natural Color",Baby Products,$18.17
