Product_ID,Product_Name,Domain,Product_Price
B005ZBHZDO,"Prince Lionheart weePOD Basix, Ash Grey",Baby Products,$14.99
B005ZLSGRS,"Tommee Tippee Closer to Nature Stage 2 Easy Reach Chewther, 4Months plus (Discontinued by Manufacturer)",Baby Products,$7.40
B005ZNCC9Y,"KF Baby Table Corner Guard, White, 8pc, with kilofly Refrigerator Magnet",Baby Products,
B005ZNCDKM,"KF Baby Table Edge Guard with 4 Corner Guards, Black, with kilofly Refrigerator Magnet",Baby Products,
B005ZNCEPQ,"KF Baby Diaper Bag Insert Organizer (12 x 6.4 x 8 inch, Black) + Diaper Changing Pad Value Combo",Baby Products,$13.95
B005ZNCGKY,"KF Baby Finger Pinch Guard [Set of 5], with kilofly Refrigerator Magnet",Baby Products,
B005ZNCOHY,"KF Baby Table Edge Guard, Black, with kilofly Refrigerator Magnet",Baby Products,
B00607YHY2,"Dreambaby Blind Cord Wraps, Clear",Baby Products,$2.99
B0060INXFK,OXO Tot Perch Foldable Booster Seat for Big Kids- Green,Baby Products,$29.99
B0060JJGBO,"Star Kids Play 'N Go Travel Tray, Green",Baby Products,$27.99
B0060SYG6U,Kate Aspen Born to be Wild Animal Place Card/Photo Holders,Baby Products,$8.32
B0061BW6UE,"Graco Backless TurboBooster Car Seat, Frenzy (Discontinued by Manufacturer)",Baby Products,
B0061O38I0,"GroVia Hybrid Hook/Loop Shell Diaper, Surf, One Size (Discontinued by Manufacturer)",Baby Products,
B0061O39LQ,"GroVia Hybrid Cloth Diaper Shell, Snap Shell (Cloud)",Baby Products,$16.95
B0061RHFKE,4U2C Rear Facing Car Seat Baby Mirror,Baby Products,
B0061XTHRM,Tommee Tippee Stage 1 Chewther (Colors May Vary) (Discontinued by Manufacturer),Baby Products,$10.87
B0062BU7JA,"Floppy Seat Deluxe Velboa Shopping Cart and High Chair Cover with Messenger Bag, Black Giraffe (Discontinued by Manufacturer)",Baby Products,
B0062BVY42,"Sassy 2 Count Grow Up Cup, Purple/Orange, 9 Ounce",Baby Products,$10.99
B0062C5P4Q,"Sassy Trainer Cup 7oz, Green",Baby Products,
B0062CHPM6,"Diono Radian 2"" Carry Strap, Black",Baby Products,$6.61
B0062CXIPO,"BooginHead PaciGrip Pacifier Holder, Peach Delight (Discontinued by Manufacturer)",Baby Products,$7.99
B0063G5H12,Seaside Monthly Baby Bodysuit Stickers,Baby Products,$39.99
B0063KFM4U,"Barin Toys Cotton Breastfeeding Necklace, White",Baby Products,
B0063RPK9K,"Kushies Art Smock with sleeves, Fuchsia Crazy Circles, 2-4 Years",Baby Products,
B0063THTRE,MAM Ba 7022-024-4-1 MAM Mini Cooler Teether with Clip Green Green,Baby Products,$9.00
B00643FPKW,"Philips AVENT Nighttime Disposable Breast Pads, 20-Count",Baby Products,$4.49
B00643FQVA,Philips AVENT BPA Free Breastcare Essentials Set,Baby Products,$11.19
B00643FRUA,"Philips AVENT Thermal Gel Pads, 2-Pack",Baby Products,
B00648JQ2A,"Zoë b Organic Fantastic Anti-Plastic Dishes Set, Turquoise/Lime (Discontinued by Manufacturer)",Baby Products,
B00648KZ7K,"make my day Silicone Baby Bib, Purple (Discontinued by Manufacturer)",Baby Products,
B0064GZ4G4,Rhoost Finger Guard - Black - 2 ct,Baby Products,
B0064ONJDQ,Gerber Training Pants 18 Month 6 Pair Girl,Baby Products,
B0064QLRTW,BOB Sun Shield for Revolution/Stroller Strides Single Stroller,Baby Products,$59.99
B0064ZO8JY,"Balboa Baby Stroller Liner, Red Poppy (Discontinued by Manufacturer)",Baby Products,$47.20
B0065052Z2,"Skip Hop Complete Sheet, Mod Dot (Discontinued by Manufacturer)",Baby Products,
B0065056RG,"Skip Hop Complete Sheet, Alphabet Zoo (Discontinued by Manufacturer)",Baby Products,$24.99
B0065ADP4C,"Supergate Ergo Pressure or Hardware Mount Plastic Gate, Ivory, Fits Spaces between 26"" to 42"" Wide and 26""high",Baby Products,$29.99
B0065IKXYO,"Bumkins Dr. Seuss 2 Piece Pajama Set, Green/Yellow, 12 Months",Baby Products,
B0065IKYQQ,"Bumkins Dr. Seuss Short Sleeve Toddler Tee, Blue Cat in Hat, 4T",Baby Products,$14.99
B0065LTW52,Simplisse Dr Brown's Double Electric Breast Pump (Discontinued by Manufacturer),Baby Products,$199.99
B0065S67NK,"Carter's Lamp Base and Shade, Sunny Safari (Discontinued by Manufacturer)",Baby Products,
B0065S67XK,"Carter's Diaper Stacker, Sunny Safari (Discontinued by Manufacturer)",Baby Products,
B0065S6AUK,"Carter's Musical Mobile, Sunny Safari",Baby Products,
B0065SLJ5Q,Kolcraft Step Starter 2-in-1 Walker - Woodstock,Baby Products,
B006670C2W,Cloth Diaper Inserts Organic Bamboo Inserts Booster Doubler (Large 8 Pack 14x5 Inch),Baby Products,
B00669SVDW,"Nuby 3 Piece Nibbler with 3 Replacement Nets, Colors May Vary (Discontinued by Manufacturer)",Baby Products,
B0066CIKNA,"FunBites Shaped Food Cutter, Green Square",Baby Products,$9.04
B0066CJF7A,FunBites Hearts - Cuts kids' food into fun-shaped bite-sized pieces . . . Great for picky eaters and bento!,Baby Products,$10.99
B0066ELMM4,FunBites Shaped Food Cutter Set Green/Pink,Baby Products,$28.48
B00674RWC2,"Munchkin Arm & Hammer Multi-Stage 3-in-1 Potty, Blue",Baby Products,$23.99
B00674RXY4,"Arm & Hammer Hand and Face Wipes, 24-Count (Discontinued by Manufacturer)",Baby Products,
B00674RZBU,"Arm & Hammer Nursery Surface Wipes, 50-Count (Discontinued by Manufacturer)",Baby Products,
B00674S1Y0,"Arm and Hammer Secure Comfort Potty Seat, Assorted colors (Discontinued by Manufacturer)",Baby Products,
B00674S37K,"Munchkin Sarabear Portable Diaper Caddy, Green Stripes",Baby Products,$22.95
B0067GKGFU,OXO Tot Perfect Pull Wipes Dispenser,Baby Products,$19.99
B0067HLO6O,Dena Happi Tree 8 Piece Crib Bedding Set (Discontinued by Manufacturer),Baby Products,
B0067JV4EE,Baby Liberty Soft-Bite Spoons MADE IN USA!,Baby Products,$9.99
B0067VJ7J6,"Pura Kiki Pebble Silicone Bottle Sleeve, Grape, Short",Baby Products,
B0068AGA96,Piyo Piyo Pacifier Clip,Baby Products,$19.98
B0069JBKHI,"Withings Smart Baby Monitor, White",Baby Products,
B0069MDTBU,"Fisher-Price Fastfinder Deluxe Messenger Diaper Bag, Black",Baby Products,
B0069MDTD8,"Fisher Price Fisher Price Fastfinder Deluxe Messenger Bag, Grey",Baby Products,$23.99
B0069MDVDG,"Fisher-Price Fastfinder Deluxe Fashion Diaper Tote, Brown Nylon",Baby Products,
B0069MDXS4,"Baby Essentials Utility Messenger Diaper Bag, Olive",Baby Products,
B0069Z307U,Idea Factory Potty Hook,Baby Products,$2.99
B006AXWVP8,Spectra 9 Advanced Double Electric Breast Pump with Tote! 2 Phase Cycling! Rechargeable Battery!,Baby Products,
B006B4OQCM,Motorola Additional Camera for Motorola MBP33 Baby Monitor,Baby Products,$99.99
B006BHSAB2,,Baby Products,
B006BIE394,WubbaNub Blue Bear Pacifier,Baby Products,$14.95
B006CFAQWE,,Baby Products,
B006CFBIX0,"Boppy Comfy Jersey Slipcover, Stamp Collector (Discontinued by Manufacturer)",Baby Products,
B006CFCNDO,Graco Ultra Clear Analog Baby Monitor with 2 Parent Units (Discontinued by Manufacturer),Baby Products,
B006CU8XYM,Nurtria Basic BPA Free Sippy Cups 6 pack  Green,Baby Products,
B006CWQB4E,One Size Elite FuzziBunz Cloth Diaper (Light It Up Blue),Baby Products,
B006CWTL9G,"Dandelion Organic Baby Doll Rattle, Brunette (Discontinued by Manufacturer)",Baby Products,
B006DHKZEU,"Bumkins Dr. Seuss Receiving Blanket, Red Stripe (Discontinued by Manufacturer)",Baby Products,
B006DNLNOK,"Itzy Ritzy Snack Happens Mini Reusable Snack and Everything Bag, Modern Damask, Mini",Baby Products,$11.43
B006EVK608,"Goumikids - Goumimitts, Scratch Free Baby Mittens, Organic Soft Stay On Unisex Mittens, Stops Scratches and Prevents Germs",Baby Products,$9.99 - $22.00
B006F3X2NS,"The Happy Closet Baby Closet Dividers, Pink and White",Baby Products,
B006FPQ86Y,"6 Packs of NUK Replacement Silicone Spout, Clear",Baby Products,$15.99
B006FS3BFM,Britax Child Bike Seat (Prior Model),Baby Products,
B006G1Q0BA,Momma Goose Zooley Elephant,Baby Products,$24.95
B006G9F8AQ,"Natursutten 2 Pack BPA Free Natural Rubber Pacifier, Butterfly Orthodontic, 6 - 12 Months",Baby Products,$22.99
B006G9GYF4,"Luxe Basics Cover Comfy Contoured Changing Pad Cover, Ivory Dot",Baby Products,$19.99
B006GCAMG8,Nuk Clear Silicone Replacement Soft Spouts (Pack of 4),Baby Products,$11.49
B006GH4QS8,"SwaddleMe Muslin Blanket, Go Team, 3-Pack (Discontinued by Manufacturer)",Baby Products,$19.99
B006GH8CME,"Boogie Snatcher: Infant, Baby Nose Cleaning Tweezers. Cleans Your Infants Nose For Better Sleep!",Baby Products,
B006GYLKOO,"Philips Avent Day Disposable Breast Pads, 60 Count",Baby Products,$7.95
B006GYLL7K,"Philips AVENT 9 Ounce BPA Free Natural Drinking Cup, 1-Pack, Red (Discontinued by Manufacturer)",Baby Products,$10.10
B006HY8BJU,"Eddie Bauer Strap Cover Buddies, Brown Dog (Discontinued by Manufacturer)",Baby Products,
B006I0R0UE,"The First Years Deluxe Reclining Feeding Seat, Dots (Discontinued by Manufacturer)",Baby Products,
B006I0R0XQ,"The First Years Soft Grip Trainer Seat, Blue",Baby Products,$12.07
B006I0R3E2,"The First Years Grown Up Trainer Cup, Disney Fairies, 9 Ounce (Discontinued by Manufacturer)",Baby Products,
B006I0R4QO,The First Years 6 Pack Ziploc Snacks To Go (Discontinued by Manufacturer),Baby Products,
B006I0R5AO,"The First Years 3 Pack Gumdrop Slim Neck Bottle, Pink/Purple, 8 Ounce (Discontinued by Manufacturer)",Baby Products,$24.95
B006I0R6VM,Lamaze Mittens the Kitten,Baby Products,
B006I0R6ZI,Lamaze Feel Me Fish Developmental Toy (Discontinued by Manufacturer),Baby Products,
B006I0R7N4,"Lamaze Developmental Toy, Flip Flop Fred (Discontinued by Manufacturer)",Baby Products,
B006I0R7Q6,Lamaze Huey the Hedgehog,Baby Products,
B006I0R8GA,Lamaze Freddie The Firefly Musical Mobile (Discontinued by Manufacturer),Baby Products,
B006I0R8LU,Lamaze Monkey In The Mirror,Baby Products,
B006I0R98W,Lamaze Peek-A-Boo Puppy Cloth Book (Discontinued by Manufacturer),Baby Products,
B006I0R9CI,Lamaze Mittens The Kitten Cloth Book (Discontinued by Manufacturer),Baby Products,
B006I18WQE,"Leachco Prop 'R Shopper Body Fit Shopping Cart Cover, Pink Forest Frolics",Baby Products,$39.99
B006I1QTYQ,Diono Radian Angle Adjuster,Baby Products,$6.93
B006I1ZMJ4,"Baby Buddy Secure-A-Toy, Safety Strap Secures Toys, Teether, or Pacifiers to Strollers, Highchairs, Car SeatsAdjustable Length to Keep Toys Sanitary Clean Red-Silver 2 Count",Baby Products,$6.78
B006IIHONY,"AppleCheeks Envelope Cloth Diaper Cover, Cherry Tomato, Size 2 (18-35+ lbs)",Baby Products,$17.00
B006ISOQO4,"AppleCheeks One-Size 2-Layer Rayon from Bamboo Inserts, 2-pack",Baby Products,$17.75
B006J2U4T0,"Bumkins Reusable Flannel Wipes, 12 Count, Natural",Baby Products,$9.86
B006J6LTP4,"The Original CJ's BuTTer (Unscented, 12 oz. tub)",Baby Products,$33.95
B006JFTS4Y,"oogaa Silicone Placemat, Blue",Baby Products,
B006JH3MIK,"Bummis Swimmi Cloth Diapers, Bubbles, Small (9-15 lbs)",Baby Products,$14.29
B006JHD5V4,"Natursutten 2 Pack BPA Free Natural Rubber Pacifier, Butterfly Rounded, 0 - 6 Months",Baby Products,
B006JINB1M,"Prince Lionheart Backseat Kick Mat, Black",Baby Products,$13.99
B006JINBD0,"Prince Lionheart Child View Mirror, Black",Baby Products,$15.31
B006JINDJC,"Prince Lionheart Seat Neat, Black/Grey",Baby Products,$10.15
B006JOF9IE,"Carter's Everyday Tote Bag, Brown/Blue (Discontinued by Manufacturer)",Baby Products,$19.99
B006JTNXDW,2 in 1 Professional Clinical RY230 Large LCD Non-contact Infrared Thermometer - Forehead and Surface,Baby Products,$32.95
B006JV4HC6,"Inglesina 2013 Fast Table Chair, Liquirizia (Discontinued by Manufacturer)",Baby Products,
B006K4R3VO,"Baby Jogger 2012 City Elite Single Stroller, Black (Discontinued by Manufacturer)",Baby Products,
B006K69WES,"Summer Infant SwaddleMe 2-Pack, Cheetah (Discontinued by Manufacturer)",Baby Products,
B006K6DF9Q,"Summer Infant SwaddlePod 2-Pack, Hungry Caterpillar, Newborn (Discontinued by Manufacturer)",Baby Products,$16.99
B006KXVKQ4,"juDanzy Girl Stripes baby leg warmers 4 pack for babies, toddlers & children",Baby Products,$17.99
B006KYL22U,"Medela Compatible Breast Pump Tubing - Tender Tubes ( 2 Tubes in one package) - For Pump in Style Original and Advanced Breast Pump - BPA Free, 42 inches",Baby Products,
B006LA7QSM,"""Deluxe"" Baby Inkless Footprint Kit with White Papers",Baby Products,$16.95
B006LJATXW,Urban Sumo Messenger Diaper Bag & Backpack By Okiedog (Coral),Baby Products,$153.66
B006LKWH68,"Bedtime Originals Honey Bear 4 Piece Bumper, Brown/Green",Baby Products,$31.82
B006LKX0XC,"Ba Baby Bottle Holder, Pink",Baby Products,$24.95
B006MOXV04,Playtex Diaper Genie On The Go Dispenser,Baby Products,$17.41
B006MOXV0O,"Playtex Flip Top Snacker with Twist 'N Click, Color may vary",Baby Products,$10.69
B006MOXV36,Playtex Muppets Insulator Spout (Discontinued by Manufacturer),Baby Products,
B006MOXV3G,Playtex Diaper Genie On The Go Dispenser Refills (Discontinued by Manufacturer),Baby Products,$16.99
B006MOXWD0,"Playtex Baby Nurser Baby Bottle with Drop-Ins Disposable Liners, Closer to Breastfeeding, 8 Ounce - 5 Pack",Baby Products,
B006MOXWE4,"Playtex Premium Nurser Baby Bottle, White, 3-Count (Discontinued by Manufacturer)",Baby Products,
B006MVHCN4,"Oeuf Pure and Simple Contoured Changing Pad, Natural",Baby Products,$58.00
B006MW2WTW,"Inglesina 2012 Trip Stroller, Ibisco (Discontinued by Manufacturer)",Baby Products,
B006MW2XE6,"Inglesina 2012 Swift Stroller, Liquirizia (Discontinued by Manufacturer) (Discontinued by Manufacturer)",Baby Products,
B006MXPGGW,"timi & leslie Jessica Diaper Bag Set, Pewter",Baby Products,
B006NTY1G6,North States Superyard Colorplay 2 Panel Extension,Baby Products,$28.49
B006NWMNPO,,Baby Products,
B006O7AAK8,"Bunnies By The Bay Plush Toy, Bloom (Discontinued by Manufacturer)",Baby Products,
B006O7XO6K,Fisher-Price Discover 'n Grow Crib-To-Floor Mobile (Discontinued by Manufacturer),Baby Products,
B006OJIJJK,"KidCo Auto-Close Configure Gate, Black",Baby Products,$130.00
B006OJIJVI,Kidco Angle Mount Safeway Pet Gate,Baby Products,$52.95
B006OJIKD0,"KidCO Auto Close HearthGate, Black",Baby Products,$169.95
B006OJIXQO,"KidCo Custom Fit (G3000) - White - 24""",Baby Products,$30.00
B006OK476S,"Ah Goo Baby Diaper Travel Pouch, Zoo Frenzy Pattern",Baby Products,$19.49
B006OKU7NU,"Soft Gear My Deluxe Changing Mat, Pink (Discontinued by Manufacturer)",Baby Products,
B006OO57J0,"Summer Infant 02000Z Baby Touch Silicone Protector, Pink",Baby Products,$7.26
B006OOGBGI,Summer Infant 02000Z Baby Touch Recharge Base with Adaptor,Baby Products,
B006P05S0Q,BRICA goPad Diaper Changer,Baby Products,$19.29
B006P05S1K,BRICA Stay-On Window Shade (Discontinued by Manufacturer),Baby Products,
B006P05S2Y,BRICA Cover Guard Car Seat Travel Bag,Baby Products,$43.99
B006P05S3I,BRICA Stretch-to-Fit Window Shade (Discontinued by Manufacturer),Baby Products,
B006P05S42,BRICA Corner Bath Basket Toy Organizer (Discontinued by Manufacturer),Baby Products,
B006P05SHO,Munchkin Super Scoop Bath Toy Organizer,Baby Products,
B006P05SHY,BRICA Bath Kneeler (Discontinued by Manufacturer),Baby Products,$34.56
B006PASHMW,Clevamama Microwave Soother Pacifier Steriliser (BPA-free),Baby Products,$18.17
B006PASHOK,Clevamama Clevafeed (Discontinued by Manufacturer),Baby Products,
B006PASIJ4,"Clevamama Splash and Wrap Baby Bath Towel (Hood, Cream)",Baby Products,$23.91
B006PASIL2,Clevamama Full Length Bath Mat with Kneeling Cushion,Baby Products,$11.99
B006PAUPVI,"Nuby 6-Pack Children's Hangers, Pink",Baby Products,$11.95
B006PB2AO2,"Evenflo Embrace 35 Infant Car Seat Base, Black (Discontinued by Manufacturer)",Baby Products,
B006PB2B3M,"Evenflo Triumph 65 LX Convertible Car Seat, Easton (Discontinued by Manufacturer)",Baby Products,
B006PB2B3W,Evenflo Tribute LX Convertible Car Seat - Neptune,Baby Products,$54.99
B006PB2BJQ,"Evenflo AMP Select Car Booster Seat, Butterfly",Baby Products,$24.99
B006PB2C5O,"Evenflo AMP High Back Car Seat Booster, Pink Angles",Baby Products,$29.49
B006PB2EDY,,Baby Products,
B006PB2EXO,"Evenflo Portable BabySuite 300, Marianna",Baby Products,
B006PB2FX8,"Evenflo Compact Fold High Chair, Marianna",Baby Products,
B006PB2GJ6,"Evenflo Modern 200 High Chair, Tangerine (Discontinued by Manufacturer)",Baby Products,
B006PB2H40,Evenflo Soft N Wide Gate,Baby Products,
B006PJC4G8,Picky Sticky Baby Month Onesie Stickers (Primary Fairy),Baby Products,
B006QBI7ZW,Hotsling's AP Baby Sling,Baby Products,$35.95 - $64.95
B006QH43FE,Baby Jogger City Mini Single Stroller,Baby Products,$259.99
B006QH43WW,"Baby Jogger 2012 City Mini GT Single Stroller, Shadow/Orange (Discontinued by Manufacturer)",Baby Products,
B006QH459I,"Baby Jogger City Mini GT Double Stroller, Shadow/Orange (Discontinued by Manufacturer)",Baby Products,
B006QI1PCW,Evenflo ExerSaucerJump and Learn Stationary Jumper Jam Session,Baby Products,$129.99
B006QNV32E,"NUK Breast Wipes, 30-Count",Baby Products,
B006QRFDZI,,Baby Products,
B006QRFO3O,"Swaddlebees Simplex 2.0 All in One Cloth Diaper (Medium, Butterflies)",Baby Products,$18.99
B006QSDLMY,,Baby Products,
B006QY5P54,,Baby Products,
B006QYQGQ6,,Baby Products,
B006R3KBYO,Medela Breastmilk Storage Solution,Baby Products,
B006RDQJL8,"Skip Hop Baby Treetop Friends Wall Decals, Multi",Baby Products,$22.99
B006RITFHS,"green sprouts 3 Count Waterproof Pocket Bib, Apples, 9-18 months (Discontinued by Manufacturer)",Baby Products,$11.99
B006S8Y68A,Boon Catch Plate With Spill Catcher Blue/Orange,Baby Products,$7.08
B006SFUCSG,Munchkin 6 Piece Fork and Spoon Set,Baby Products,$3.26
B006SFUCT0,"Munchkin Time Saver Bottle Warmer, White",Baby Products,
B006SFUCTK,Munchkin Digital Bottle Warmer,Baby Products,
B006SFUCV8,"Munchkin High Capacity Drying Rack, White",Baby Products,$12.75
B006SFUD2G,"Munchkin Travel Car Baby Bottle Warmer, Grey",Baby Products,$13.69
B006SFUD4E,"Munchkin SpongeBob SquarePants Click Lock Insulated Straw Cup, Colors May Vary, 9 Ounce",Baby Products,
B006SFUDQM,"Munchkin Bubble Spout Guard, Blue",Baby Products,$9.99
B006SFUDSU,Munchkin Arm & Hammer 3 Piece Nursery Fresheners with Brackets,Baby Products,
B006SFUDT4,"Munchkin Scoop Drain and Store Bath Toy Organizer, Blue",Baby Products,
B006SFUDTE,"Munchkin Bath Fun Bubble Blower, Blue (Discontinued by Manufacturer)",Baby Products,$22.49
B006SFUEF2,"Munchkin Nursery Projector and Sound System, White",Baby Products,$22.40
B006SFUEFC,"Munchkin Precision Fit 24"" Gate, White (Discontinued by Manufacturer)",Baby Products,
B006SFUEFM,"Munchkin 2 Piece Stroller Swivel Hooks, Black",Baby Products,
B006SFUEG6,"Munchkin Quick Install 26"" Gate, Black (Discontinued by Manufacturer)",Baby Products,
B006SFUEN4,"Munchkin 4 Piece Re-Usable Straw Cups, 10 Ounce Colors May Vary",Baby Products,
B006SFUENO,"Munchkin Wide Spaces Expanding Gate, Light Wood (Discontinued by Manufacturer)",Baby Products,
B006SQDSZ4,"Similac Infant Nipples & Rings, Standard Flow, Ready to Use, Pack of 10 (0 - 12 Months)",Baby Products,$13.50
B006SRJHGM,BambinOz Anywhere Chair Travel High Chair,Baby Products,
B006STJUBC,"Skip Hop Alphabet Zoo Activity Gym, Multi",Baby Products,$74.82
B006STJURG,"Skip Hop Alphabet Zoo Activity Mirror, Multi",Baby Products,$15.99
B006STJVGQ,Skip Hop Alphabet Zoo Stack and Stick Animals,Baby Products,$26.53
B006SVWGWK,"Mud Pie Baby-boys Newborn First Birthday Bib, Blue/White, One Size (Discontinued by Manufacturer)",Baby Products,
B006T2P9VI,"Innobaby Packin' SMART Keepaa Juice Box Holder, Strawberry",Baby Products,$9.05
B006T6CJCG,"Peg Perego Siesta Highchair, Noce",Baby Products,$299.99
B006T899QI,"Medela Calma Breastmilk Feeding Set, 5 Ounce",Baby Products,$15.99
B006T89X9Q,Medela Calma Breastmilk Feeding Nipple,Baby Products,
B006TJUMKY,Cybex 2.GO Baby Carrier - Chilli Pepper,Baby Products,
B006TVS7U4,"Dr. Brown's Gia Nursing Pillow Cover, Sloane (Discontinued by Manufacturer)",Baby Products,
B006TWH4R0,Molar Muncher Hands Free Teether,Baby Products,$12.97
B006U480FM,"Gerber Graduates Mealtime Organizer, Colors May Vary (Discontinued by Manufacturer)",Baby Products,
B006U9DCNC,"Medela PersonalFit Breast Shield, Large",Baby Products,$14.72
B006UA1HE2,"Carter's Keep Me Dry 3 Piece Flannel Lap Pad, Monkey (Discontinued by Manufacturer)",Baby Products,
B006UA1HIS,"Carter's Keep Me Dry Flannel Bassinet Pad, Monkey (Discontinued by Manufacturer)",Baby Products,
B006UDLXFM,"Boppy Nursing Cover, Olivia Floral (Discontinued by Manufacturer)",Baby Products,
B006UDLXFW,"Boppy Travel Pillow, Mama Dot/Basket Green (Discontinued by Manufacturer)",Baby Products,
B006UDLXGQ,"Boppy Infant to Toddler Head and Neck Support, Prism Gray",Baby Products,$8.99
B006UDLXJ8,,Baby Products,
B006UJLHMK,"Leachco BumpZZZ Travel Bed, Brown/Green Forest Frolics",Baby Products,$124.81
B006UKL5YE,Blooming Bath - Baby Bath (Hot Pink),Baby Products,$39.99
B006UMUB92,"Kidco Safeway Gate, Top of Stairs Gate, White",Baby Products,$49.99
B006UR2578,"The Original CJ's BuTTer (All Natural Mango Sugar Mint, 12 oz. tub)",Baby Products,$36.99
B006UY170M,Medela Replacement Clear Cap For Bottles,Baby Products,$5.59
B006V84JLG,"Munchkin Dora the Explorer Click Lock Insulated Sippy Cup, 9 Ounce, 2-Count",Baby Products,$8.99
B006V84KFQ,"Munchkin Click Lock 2 Count Insulated Sippy Cup, 9 ounce",Baby Products,$10.23
B006V84KQU,"Munchkin Sesame Street Click Lock Insulated Sippy Cup, 9 oz., Colors May Vary, 2 Count",Baby Products,$9.99
B006V84M1I,"Munchkin Click Lock Trainer Cup, Green/Orange, 2 Count, 7 Ounce (Discontinued by Manufacturer)",Baby Products,
B006V84ME0,Munchkin Click Lock Straw Cup - 9 oz - 2 pk - Colors May Vary,Baby Products,
B006VIHL48,"Born Free 5 oz. BPA-Free Premium Glass Bottle with Bonus Silicone Sleeve, 3-Pack",Baby Products,
B006VIQUYA,"Dr. Brown's Baby Bottle, 4 Ounce, 3-Count - Pink",Baby Products,
B006VJJPPK,NUK Barely There Nipple Shield with Case,Baby Products,$4.49
B006VJM7AA,NUK Orthostar Soft Silicone Orthodontic Pacifiers 0-3 months- Blue/Green,Baby Products,$5.97
B006VK2W7W,Born Free BPA-Free Calm 'N Soothe Flower Teether,Baby Products,
B006VOJ8LG,Dr. Brown's BPA Free Baby Bottles 8 Oz. - Pink - 3 Pack,Baby Products,$15.99
B006VPC5R4,Summer Infant Tubside Seat,Baby Products,$17.99
B006VPC7UY,"Summer Infant SwaddleMe Adjustable Infant Wrap, Dino Peek/Stripe/Sage, Boy, Small/Medium",Baby Products,$19.90
B006VXLBQM,"ABC Fun Pads Shopping Cart Cover, Elmo",Baby Products,$29.95
B006VZ50BC,"Hudson Baby 2 Count Muslin Swaddle Blanket, Blue",Baby Products,$13.19
B006W1M7DO,"HALO SleepSack 5-Piece Bumper-Free Crib Set, Caterpillar (Discontinued by Manufacturer)",Baby Products,
B006W79L2S,"Lansinoh mOmma Straw Cup, Orange (Discontinued by Manufacturer)",Baby Products,
B006W79L3C,"Lansinoh mOmma Brush, Orange",Baby Products,
B006W79M9K,"Lansinoh mOmma Mealtime Soft Spoon, Orange",Baby Products,$7.98
B006WE40UE,"Frenchie Mini Couture Kid's Robot Feeder with Flip Over Pocket (3-Pack), Blue",Baby Products,$9.99
B006WHR6CU,"Munchkin Click Lock 2 Count Sippy Cup, 9 ounce (Discontinued by Manufacturer)",Baby Products,
B006WLDJWW,"RECARO Euro Convertible Seat, River (Discontinued by Manufacturer)",Baby Products,
B006WMO4Q6,Razbaby RaZberry Teether - Red/Blue 2-Pack,Baby Products,$10.63
B006WN63XM,"Mommy's Helper Toilet Seat Lid-Lok, Set of 2",Baby Products,$24.99
B006WU9N64,"Thirsties Duo All in One Snap, Blackbird, Size One (6-18 lbs)",Baby Products,
B006WU9S82,"Thirsties Duo All in One Cloth Diaper, Blackbird, Size One (6-18 lbs)",Baby Products,
B006X12RTC,"Toddler Size Waterproof Bib w/Flip Pocket, 2 Pack, Green Robot",Baby Products,
B006XGAOB0,"Graco Embroidered Boa Blanket, in The Forest (Discontinued by Manufacturer)",Baby Products,
B006Y3S838,"Munchkin Click Lock 2 Count Flip Straw Cup, 9 ounce",Baby Products,$6.09
B006Y7OS1A,"3 Sprouts Storage Bin, Monkey",Baby Products,$19.99
B006Y7OWDY,"3 Sprouts Hooded Towel, Yellow Monkey",Baby Products,$14.99
B006Y7OYPA,"3 Sprouts Storage Caddy, Mouse",Baby Products,$14.99
B006Y7P1MK,"3 Sprouts Storage Box, Dog",Baby Products,$16.99
B006YBG1WA,"Baby Einstein Mobile, Sweet Sea Dreams",Baby Products,
B006YBHE6M,Baby Einstein Sea Dreams Soother,Baby Products,
B006YDFZSO,Infantino Stay and Play Funflower Highchair or Stroller Toy,Baby Products,$14.50
B006YPTWF4,"Lansinoh mOmma Nipples Slow-Flow, 2 Count, 100% Silicone, Anti-Colic, BPS and BPA Free, Easy to Clean and Assemble, Microwave and Dishwasher Safe",Baby Products,
B006YPTWHC,"Lansinoh mOmma Feeding Bottle, 5 Oz, 1 Count (Discontinued by Manufacturer)",Baby Products,
B006YPTZLU,"Lansinoh mOmma Spill Proof Cup with Dual Handles Green, Safe and Hygienic, Ideal for 6 Months and Older, Spill Proof Technology, Dishwasher and Microwave Safe, BPA Free",Baby Products,$5.50
B006YPTZOM,"Lansinoh mOmma Straw Cup with Dual Handles, Orange",Baby Products,$6.99
B006Z220IM,Triple 8 FLO Diaper Sprayer,Baby Products,
B006Z2BZAQ,"Dream On Me, 3"" inner spring Carina Collection Pack N Play Mattress (Packaging may vary)",Baby Products,$43.37
B006Z2BZBU,Dream On Me Foam Pack and Play Mattress,Baby Products,$39.93
B006Z2BZN8,"Dream On Me 4 in 1 Aden Convertible Mini Crib, Natural",Baby Products,$119.99
B006Z2BZOM,"Dream On Me 3"" Foam Play Yard Mattress",Baby Products,$32.72
B006Z6D5X2,"OXO Tot Toothbrushing Station, Green (Discontinued by Manufacturer)",Baby Products,$29.99
B006Z6E80Q,NUK Homemade Baby Food Flexible Freezer Tray and Lid Set,Baby Products,$5.39
B006Z6E810,NUK Fill & Freeze Pops (Discontinued by Manufacturer),Baby Products,
B006Z6E860,"NUK Stack & Store Cups, 6 Cups and lids",Baby Products,$8.98
B006Z6E8AG,NUK Mash and Serve Bowl for Making Homemade Baby Food,Baby Products,$5.99
B006Z6E9DW,NUK Make it Easy Starter Set (Discontinued by Manufacturer),Baby Products,
B006Z6E9I2,NUK Cook-n-Blend Baby Food Maker (Discontinued by Manufacturer),Baby Products,
B006Z6HXOO,"Ah Goo Baby Wipes Case, On-the-Go Travel Size, Audrey Pattern",Baby Products,$14.97
B006ZANKSI,"Maclaren Volo Stroller, Scarlet (Discontinued by Manufacturer)",Baby Products,
B006ZBH8LM,"Maclaren Quest Sport Stroller, Black/Champagne (Discontinued by Manufacturer)",Baby Products,$279.99
B006ZBNE4M,Born Free Classic Bottle - 5 oz - 3 ct,Baby Products,
B006ZBREJ8,"Born Free BPA-Free Fast Flow Silicone Nipples, 6+ Month",Baby Products,$39.97
B006ZETYLQ,Nuk Disney Active Cup 10 Oz. 12m+ with Silicone Spout (Girls Color),Baby Products,
B006ZFO4W4,"green sprouts Cool Calm Press, Turtle",Baby Products,$5.99
